"No.","Time","Source","Destination","Protocol","Length","Info"
"1","0.000000","10.133.147.141","ocsp-a.g.aaplimg.com","TCP","40","49264  >  https(443) [FIN, ACK] Seq=1 Ack=1 Win=16384 Len=0"
"2","0.000508","ocsp-a.g.aaplimg.com","10.133.147.141","TCP","46","https(443)  >  49264 [FIN, ACK] Seq=1 Ack=2 Win=251 Len=0"
"3","0.001189","10.133.147.141","ocsp-a.g.aaplimg.com","TCP","40","49264  >  https(443) [ACK] Seq=2 Ack=2 Win=16384 Len=0"
"4","0.001609","N/A","N/A","N/A","42","Raw packet data"
"5","0.004486","N/A","N/A","N/A","42","Raw packet data"
"6","0.004537","N/A","N/A","N/A","42","Raw packet data"
"7","0.006244","N/A","N/A","N/A","42","Raw packet data"
"8","0.006954","N/A","N/A","N/A","42","Raw packet data"
"9","0.007555","N/A","N/A","N/A","42","Raw packet data"
"10","0.008170","N/A","N/A","N/A","42","Raw packet data"
"11","0.008916","N/A","N/A","N/A","42","Raw packet data"
"12","0.011708","N/A","N/A","N/A","42","Raw packet data"
"13","0.012682","N/A","N/A","N/A","42","Raw packet data"
"14","0.013162","10.133.147.141","e1329.g.akamaiedge.net","HTTP","368","GET /assets/com_apple_MobileAsset_DictionaryServices_dictionary2/com_apple_MobileAsset_DictionaryServices_dictionary2.xml HTTP/1.1 "
"15","0.013928","e1329.g.akamaiedge.net","10.133.147.141","TCP","46","http(80)  >  49268 [ACK] Seq=1 Ack=329 Win=501 Len=0"
"16","0.014810","e1329.g.akamaiedge.net","10.133.147.141","HTTP","318","HTTP/1.1 304 Not Modified "
"17","0.016008","10.133.147.141","e1329.g.akamaiedge.net","TCP","40","49268  >  http(80) [ACK] Seq=329 Ack=279 Win=16366 Len=0"
"18","0.016605","N/A","N/A","N/A","42","Raw packet data"
"19","0.018125","10.133.147.141","146.57.254.139","TCP","40","49227  >  https(443) [FIN, ACK] Seq=1 Ack=1 Win=16384 Len=0"
"20","0.018711","146.57.254.139","10.133.147.141","TLSv1.2","71","Encrypted Alert"
"21","0.019173","146.57.254.139","10.133.147.141","TCP","46","https(443)  >  49227 [FIN, ACK] Seq=32 Ack=2 Win=269 Len=0"
"22","0.019641","10.133.147.141","146.57.254.139","TCP","40","49227  >  https(443) [RST] Seq=2 Win=0 Len=0"
"23","0.020152","10.133.147.141","146.57.254.139","TCP","40","49227  >  https(443) [RST] Seq=2 Win=0 Len=0"
"24","0.020610","N/A","N/A","N/A","42","Raw packet data"
"25","0.021154","N/A","N/A","N/A","42","Raw packet data"
"26","0.021943","N/A","N/A","N/A","42","Raw packet data"
"27","0.023614","N/A","N/A","N/A","42","Raw packet data"
"28","0.024106","N/A","N/A","N/A","42","Raw packet data"
"29","0.024919","N/A","N/A","N/A","42","Raw packet data"
"30","0.025788","N/A","N/A","N/A","42","Raw packet data"
"31","0.026663","N/A","N/A","N/A","42","Raw packet data"
"32","0.029057","N/A","N/A","N/A","42","Raw packet data"
"33","0.029926","N/A","N/A","N/A","42","Raw packet data"
"34","0.030658","N/A","N/A","N/A","42","Raw packet data"
"35","0.031485","N/A","N/A","N/A","42","Raw packet data"
"36","0.032284","N/A","N/A","N/A","42","Raw packet data"
"37","1.035551","N/A","N/A","N/A","42","Raw packet data"
"38","1.036067","N/A","N/A","N/A","42","Raw packet data"
"39","1.036922","N/A","N/A","N/A","42","Raw packet data"
"40","1.037738","N/A","N/A","N/A","42","Raw packet data"
"41","1.038413","N/A","N/A","N/A","42","Raw packet data"
"42","1.038938","N/A","N/A","N/A","42","Raw packet data"
"43","1.039436","N/A","N/A","N/A","42","Raw packet data"
"44","1.044390","N/A","N/A","N/A","42","Raw packet data"
"45","1.045429","N/A","N/A","N/A","42","Raw packet data"
"46","1.046094","N/A","N/A","N/A","42","Raw packet data"
"47","1.046723","10.133.147.141","e1329.g.akamaiedge.net","TCP","64","49269  >  http(80) [SYN] Seq=0 Win=65535 Len=0 MSS=1460 WS=16 TSval=155123545 TSecr=0 SACK_PERM=1"
"48","1.047464","e1329.g.akamaiedge.net","10.133.147.141","TCP","52","http(80)  >  49269 [SYN, ACK] Seq=0 Ack=1 Win=64240 Len=0 MSS=1386 SACK_PERM=1 WS=128"
"49","1.047974","10.133.147.141","e1329.g.akamaiedge.net","TCP","40","49269  >  http(80) [ACK] Seq=1 Ack=1 Win=262144 Len=0"
"50","1.048403","10.133.147.141","e1329.g.akamaiedge.net","TCP","64","49270  >  http(80) [SYN] Seq=0 Win=65535 Len=0 MSS=1460 WS=16 TSval=155123550 TSecr=0 SACK_PERM=1"
"51","1.048796","e1329.g.akamaiedge.net","10.133.147.141","TCP","52","http(80)  >  49270 [SYN, ACK] Seq=0 Ack=1 Win=64240 Len=0 MSS=1386 SACK_PERM=1 WS=128"
"52","1.049384","10.133.147.141","e1329.g.akamaiedge.net","TCP","40","49270  >  http(80) [ACK] Seq=1 Ack=1 Win=262144 Len=0"
"53","1.049866","N/A","N/A","N/A","42","Raw packet data"
"54","1.050553","N/A","N/A","N/A","42","Raw packet data"
"55","1.051280","N/A","N/A","N/A","42","Raw packet data"
"56","1.051744","N/A","N/A","N/A","42","Raw packet data"
"57","1.052284","10.133.147.141","e1329.g.akamaiedge.net","HTTP","362","GET /assets/com_apple_MobileAsset_VoiceServicesVocalizerVoice/com_apple_MobileAsset_VoiceServicesVocalizerVoice.xml HTTP/1.1 "
"58","1.057179","10.133.147.141","e1329.g.akamaiedge.net","HTTP","336","GET /assets/com_apple_MobileAsset_LinguisticData/com_apple_MobileAsset_LinguisticData.xml HTTP/1.1 "
"59","1.057786","N/A","N/A","N/A","42","Raw packet data"
"60","1.058656","e1329.g.akamaiedge.net","10.133.147.141","TCP","46","http(80)  >  49268 [ACK] Seq=279 Ack=651 Win=501 Len=0"
"61","1.059126","e1329.g.akamaiedge.net","10.133.147.141","HTTP","319","HTTP/1.1 304 Not Modified "
"62","1.059537","10.133.147.141","e1329.g.akamaiedge.net","TCP","40","49268  >  http(80) [ACK] Seq=651 Ack=558 Win=16366 Len=0"
"63","1.060258","e1329.g.akamaiedge.net","10.133.147.141","TCP","46","http(80)  >  49269 [ACK] Seq=1 Ack=297 Win=64128 Len=0"
"64","1.060764","N/A","N/A","N/A","42","Raw packet data"
"65","1.064593","e1329.g.akamaiedge.net","10.133.147.141","TCP","1426","http(80)  >  49269 [ACK] Seq=1 Ack=297 Win=64128 Len=1386 [TCP segment of a reassembled PDU]"
"66","1.065129","e1329.g.akamaiedge.net","10.133.147.141","TCP","1426","http(80)  >  49269 [PSH, ACK] Seq=1387 Ack=297 Win=64128 Len=1386 [TCP segment of a reassembled PDU]"
"67","1.065731","10.133.147.141","e1329.g.akamaiedge.net","TCP","40","49269  >  http(80) [ACK] Seq=297 Ack=2773 Win=259360 Len=0"
"68","1.066179","e1329.g.akamaiedge.net","10.133.147.141","TCP","1426","http(80)  >  49269 [ACK] Seq=2773 Ack=297 Win=64128 Len=1386 [TCP segment of a reassembled PDU]"
"69","1.066820","e1329.g.akamaiedge.net","10.133.147.141","TCP","1426","http(80)  >  49269 [PSH, ACK] Seq=4159 Ack=297 Win=64128 Len=1386 [TCP segment of a reassembled PDU]"
"70","1.067279","10.133.147.141","e1329.g.akamaiedge.net","TCP","40","49269  >  http(80) [ACK] Seq=297 Ack=5545 Win=256592 Len=0"
"71","1.067710","e1329.g.akamaiedge.net","10.133.147.141","TCP","1426","http(80)  >  49269 [ACK] Seq=5545 Ack=297 Win=64128 Len=1386 [TCP segment of a reassembled PDU]"
"72","1.068317","e1329.g.akamaiedge.net","10.133.147.141","TCP","1426","http(80)  >  49269 [PSH, ACK] Seq=6931 Ack=297 Win=64128 Len=1386 [TCP segment of a reassembled PDU]"
"73","1.072824","e1329.g.akamaiedge.net","10.133.147.141","TCP","1426","http(80)  >  49269 [ACK] Seq=8317 Ack=297 Win=64128 Len=1386 [TCP segment of a reassembled PDU]"
"74","1.073371","10.133.147.141","e1329.g.akamaiedge.net","TCP","40","49269  >  http(80) [ACK] Seq=297 Ack=8317 Win=253824 Len=0"
"75","1.073997","e1329.g.akamaiedge.net","10.133.147.141","TCP","1426","http(80)  >  49269 [PSH, ACK] Seq=9703 Ack=297 Win=64128 Len=1386 [TCP segment of a reassembled PDU]"
"76","1.074660","10.133.147.141","e1329.g.akamaiedge.net","TCP","40","49269  >  http(80) [ACK] Seq=297 Ack=11089 Win=251056 Len=0"
"77","1.075556","e1329.g.akamaiedge.net","10.133.147.141","TCP","1426","http(80)  >  49269 [ACK] Seq=11089 Ack=297 Win=64128 Len=1386 [TCP segment of a reassembled PDU]"
"78","1.076328","e1329.g.akamaiedge.net","10.133.147.141","TCP","1426","http(80)  >  49269 [PSH, ACK] Seq=12475 Ack=297 Win=64128 Len=1386 [TCP segment of a reassembled PDU]"
"79","1.076859","10.133.147.141","e1329.g.akamaiedge.net","TCP","40","49269  >  http(80) [ACK] Seq=297 Ack=13861 Win=248272 Len=0"
"80","1.079431","e1329.g.akamaiedge.net","10.133.147.141","TCP","1426","http(80)  >  49269 [ACK] Seq=13861 Ack=297 Win=64128 Len=1386 [TCP segment of a reassembled PDU]"
"81","1.080010","e1329.g.akamaiedge.net","10.133.147.141","TCP","1426","http(80)  >  49269 [PSH, ACK] Seq=15247 Ack=297 Win=64128 Len=1386 [TCP segment of a reassembled PDU]"
"82","1.080648","e1329.g.akamaiedge.net","10.133.147.141","TCP","1426","http(80)  >  49269 [ACK] Seq=16633 Ack=297 Win=64128 Len=1386 [TCP segment of a reassembled PDU]"
"83","1.081276","e1329.g.akamaiedge.net","10.133.147.141","TCP","1426","http(80)  >  49269 [PSH, ACK] Seq=18019 Ack=297 Win=64128 Len=1386 [TCP segment of a reassembled PDU]"
"84","1.081868","10.133.147.141","e1329.g.akamaiedge.net","TCP","40","49269  >  http(80) [ACK] Seq=297 Ack=16633 Win=245504 Len=0"
"85","1.082324","10.133.147.141","e1329.g.akamaiedge.net","TCP","40","49269  >  http(80) [ACK] Seq=297 Ack=19405 Win=242736 Len=0"
"86","1.082743","e1329.g.akamaiedge.net","10.133.147.141","TCP","1426","http(80)  >  49269 [ACK] Seq=19405 Ack=297 Win=64128 Len=1386 [TCP segment of a reassembled PDU]"
"87","1.087228","e1329.g.akamaiedge.net","10.133.147.141","TCP","1426","http(80)  >  49269 [PSH, ACK] Seq=20791 Ack=297 Win=64128 Len=1386 [TCP segment of a reassembled PDU]"
"88","1.087666","10.133.147.141","e1329.g.akamaiedge.net","TCP","40","49269  >  http(80) [ACK] Seq=297 Ack=22177 Win=239968 Len=0"
"89","1.088311","e1329.g.akamaiedge.net","10.133.147.141","TCP","1426","http(80)  >  49269 [ACK] Seq=22177 Ack=297 Win=64128 Len=1386 [TCP segment of a reassembled PDU]"
"90","1.088961","e1329.g.akamaiedge.net","10.133.147.141","TCP","1426","http(80)  >  49269 [PSH, ACK] Seq=23563 Ack=297 Win=64128 Len=1386 [TCP segment of a reassembled PDU]"
"91","1.089421","10.133.147.141","e1329.g.akamaiedge.net","TCP","40","49269  >  http(80) [ACK] Seq=297 Ack=24949 Win=237184 Len=0"
"92","1.089909","10.133.147.141","e1329.g.akamaiedge.net","TCP","40","[TCP Window Update] 49269  >  http(80) [ACK] Seq=297 Ack=24949 Win=262144 Len=0"
"93","1.090634","e1329.g.akamaiedge.net","10.133.147.141","TCP","1426","http(80)  >  49269 [ACK] Seq=24949 Ack=297 Win=64128 Len=1386 [TCP segment of a reassembled PDU]"
"94","1.095038","e1329.g.akamaiedge.net","10.133.147.141","TCP","1426","http(80)  >  49269 [PSH, ACK] Seq=26335 Ack=297 Win=64128 Len=1386 [TCP segment of a reassembled PDU]"
"95","1.095671","10.133.147.141","e1329.g.akamaiedge.net","TCP","40","49269  >  http(80) [ACK] Seq=297 Ack=27721 Win=259360 Len=0"
"96","1.096249","10.133.147.141","e1329.g.akamaiedge.net","TCP","40","[TCP Window Update] 49269  >  http(80) [ACK] Seq=297 Ack=27721 Win=262144 Len=0"
"97","1.096732","e1329.g.akamaiedge.net","10.133.147.141","TCP","1426","http(80)  >  49269 [ACK] Seq=27721 Ack=297 Win=64128 Len=1386 [TCP segment of a reassembled PDU]"
"98","1.097232","e1329.g.akamaiedge.net","10.133.147.141","TCP","1426","http(80)  >  49269 [PSH, ACK] Seq=29107 Ack=297 Win=64128 Len=1386 [TCP segment of a reassembled PDU]"
"99","1.097755","10.133.147.141","e1329.g.akamaiedge.net","TCP","40","49269  >  http(80) [ACK] Seq=297 Ack=30493 Win=259360 Len=0"
"100","1.098389","10.133.147.141","e1329.g.akamaiedge.net","TCP","40","[TCP Window Update] 49269  >  http(80) [ACK] Seq=297 Ack=30493 Win=262144 Len=0"
"101","1.098995","N/A","N/A","N/A","42","Raw packet data"
"102","1.103633","e1329.g.akamaiedge.net","10.133.147.141","TCP","1426","http(80)  >  49269 [ACK] Seq=30493 Ack=297 Win=64128 Len=1386 [TCP segment of a reassembled PDU]"
"103","1.104322","e1329.g.akamaiedge.net","10.133.147.141","TCP","1426","http(80)  >  49269 [PSH, ACK] Seq=31879 Ack=297 Win=64128 Len=1386 [TCP segment of a reassembled PDU]"
"104","1.104776","e1329.g.akamaiedge.net","10.133.147.141","TCP","1426","http(80)  >  49269 [ACK] Seq=33265 Ack=297 Win=64128 Len=1386 [TCP segment of a reassembled PDU]"
"105","1.105401","10.133.147.141","e1329.g.akamaiedge.net","TCP","40","49269  >  http(80) [ACK] Seq=297 Ack=33265 Win=259360 Len=0"
"106","1.106333","e1329.g.akamaiedge.net","10.133.147.141","TCP","1426","http(80)  >  49269 [PSH, ACK] Seq=34651 Ack=297 Win=64128 Len=1386 [TCP segment of a reassembled PDU]"
"107","1.106928","e1329.g.akamaiedge.net","10.133.147.141","TCP","1426","http(80)  >  49269 [ACK] Seq=36037 Ack=297 Win=64128 Len=1386 [TCP segment of a reassembled PDU]"
"108","1.107621","e1329.g.akamaiedge.net","10.133.147.141","TCP","1426","http(80)  >  49269 [PSH, ACK] Seq=37423 Ack=297 Win=64128 Len=1386 [TCP segment of a reassembled PDU]"
"109","1.109896","10.133.147.141","e1329.g.akamaiedge.net","TCP","40","49269  >  http(80) [ACK] Seq=297 Ack=36037 Win=256592 Len=0"
"110","1.110533","10.133.147.141","e1329.g.akamaiedge.net","TCP","40","49269  >  http(80) [ACK] Seq=297 Ack=38809 Win=253824 Len=0"
"111","1.111088","e1329.g.akamaiedge.net","10.133.147.141","TCP","1426","http(80)  >  49269 [ACK] Seq=38809 Ack=297 Win=64128 Len=1386 [TCP segment of a reassembled PDU]"
"112","1.111706","e1329.g.akamaiedge.net","10.133.147.141","TCP","1426","http(80)  >  49269 [PSH, ACK] Seq=40195 Ack=297 Win=64128 Len=1386 [TCP segment of a reassembled PDU]"
"113","1.112277","10.133.147.141","e1329.g.akamaiedge.net","TCP","40","49269  >  http(80) [ACK] Seq=297 Ack=41581 Win=251056 Len=0"
"114","1.112853","e1329.g.akamaiedge.net","10.133.147.141","TCP","1426","http(80)  >  49269 [ACK] Seq=41581 Ack=297 Win=64128 Len=1386 [TCP segment of a reassembled PDU]"
"115","1.113408","e1329.g.akamaiedge.net","10.133.147.141","TCP","1426","http(80)  >  49269 [PSH, ACK] Seq=42967 Ack=297 Win=64128 Len=1386 [TCP segment of a reassembled PDU]"
"116","1.113943","10.133.147.141","e1329.g.akamaiedge.net","TCP","40","49269  >  http(80) [ACK] Seq=297 Ack=44353 Win=248272 Len=0"
"117","1.114552","e1329.g.akamaiedge.net","10.133.147.141","TCP","1426","http(80)  >  49269 [ACK] Seq=44353 Ack=297 Win=64128 Len=1386 [TCP segment of a reassembled PDU]"
"118","1.115302","e1329.g.akamaiedge.net","10.133.147.141","TCP","1426","http(80)  >  49269 [PSH, ACK] Seq=45739 Ack=297 Win=64128 Len=1386 [TCP segment of a reassembled PDU]"
"119","1.115713","10.133.147.141","e1329.g.akamaiedge.net","TCP","40","49269  >  http(80) [ACK] Seq=297 Ack=47125 Win=245504 Len=0"
"120","1.116327","e1329.g.akamaiedge.net","10.133.147.141","TCP","1426","http(80)  >  49269 [ACK] Seq=47125 Ack=297 Win=64128 Len=1386 [TCP segment of a reassembled PDU]"
"121","1.116992","e1329.g.akamaiedge.net","10.133.147.141","TCP","1426","http(80)  >  49269 [PSH, ACK] Seq=48511 Ack=297 Win=64128 Len=1386 [TCP segment of a reassembled PDU]"
"122","1.118048","10.133.147.141","e1329.g.akamaiedge.net","TCP","40","49269  >  http(80) [ACK] Seq=297 Ack=49897 Win=242736 Len=0"
"123","1.123129","e1329.g.akamaiedge.net","10.133.147.141","TCP","1426","http(80)  >  49269 [ACK] Seq=49897 Ack=297 Win=64128 Len=1386 [TCP segment of a reassembled PDU]"
"124","1.123793","e1329.g.akamaiedge.net","10.133.147.141","TCP","1426","http(80)  >  49269 [PSH, ACK] Seq=51283 Ack=297 Win=64128 Len=1386 [TCP segment of a reassembled PDU]"
"125","1.124345","10.133.147.141","e1329.g.akamaiedge.net","TCP","40","49269  >  http(80) [ACK] Seq=297 Ack=52669 Win=239968 Len=0"
"126","1.128786","e1329.g.akamaiedge.net","10.133.147.141","TCP","1426","http(80)  >  49269 [ACK] Seq=52669 Ack=297 Win=64128 Len=1386 [TCP segment of a reassembled PDU]"
"127","1.133612","e1329.g.akamaiedge.net","10.133.147.141","TCP","1426","http(80)  >  49269 [PSH, ACK] Seq=54055 Ack=297 Win=64128 Len=1386 [TCP segment of a reassembled PDU]"
"128","1.135563","10.133.147.141","e1329.g.akamaiedge.net","TCP","40","49269  >  http(80) [ACK] Seq=297 Ack=55441 Win=237184 Len=0"
"129","1.137273","e1329.g.akamaiedge.net","10.133.147.141","TCP","1426","http(80)  >  49269 [ACK] Seq=55441 Ack=297 Win=64128 Len=1386 [TCP segment of a reassembled PDU]"
"130","1.138940","e1329.g.akamaiedge.net","10.133.147.141","TCP","1426","http(80)  >  49269 [PSH, ACK] Seq=56827 Ack=297 Win=64128 Len=1386 [TCP segment of a reassembled PDU]"
"131","1.140516","e1329.g.akamaiedge.net","10.133.147.141","TCP","1426","http(80)  >  49269 [ACK] Seq=58213 Ack=297 Win=64128 Len=1386 [TCP segment of a reassembled PDU]"
"132","1.142414","10.133.147.141","e1329.g.akamaiedge.net","TCP","40","49269  >  http(80) [ACK] Seq=297 Ack=58213 Win=234416 Len=0"
"133","1.144322","e1329.g.akamaiedge.net","10.133.147.141","TCP","1426","http(80)  >  49269 [PSH, ACK] Seq=59599 Ack=297 Win=64128 Len=1386 [TCP segment of a reassembled PDU]"
"134","1.146022","10.133.147.141","e1329.g.akamaiedge.net","TCP","40","49269  >  http(80) [ACK] Seq=297 Ack=60985 Win=231648 Len=0"
"135","1.147410","e1329.g.akamaiedge.net","10.133.147.141","TCP","1426","http(80)  >  49269 [ACK] Seq=60985 Ack=297 Win=64128 Len=1386 [TCP segment of a reassembled PDU]"
"136","1.148984","e1329.g.akamaiedge.net","10.133.147.141","TCP","1426","http(80)  >  49269 [PSH, ACK] Seq=62371 Ack=297 Win=64128 Len=1386 [TCP segment of a reassembled PDU]"
"137","1.150738","10.133.147.141","e1329.g.akamaiedge.net","TCP","40","49269  >  http(80) [ACK] Seq=297 Ack=63757 Win=228880 Len=0"
"138","1.152272","e1329.g.akamaiedge.net","10.133.147.141","TCP","1426","http(80)  >  49269 [ACK] Seq=63757 Ack=297 Win=64128 Len=1386 [TCP segment of a reassembled PDU]"
"139","1.153888","e1329.g.akamaiedge.net","10.133.147.141","TCP","1426","http(80)  >  49269 [PSH, ACK] Seq=65143 Ack=297 Win=64128 Len=1386 [TCP segment of a reassembled PDU]"
"140","1.155193","e1329.g.akamaiedge.net","10.133.147.141","TCP","1426","http(80)  >  49269 [ACK] Seq=66529 Ack=297 Win=64128 Len=1386 [TCP segment of a reassembled PDU]"
"141","1.155938","10.133.147.141","e1329.g.akamaiedge.net","TCP","40","49269  >  http(80) [ACK] Seq=297 Ack=66529 Win=226096 Len=0"
"142","1.157020","e1329.g.akamaiedge.net","10.133.147.141","TCP","1426","http(80)  >  49269 [PSH, ACK] Seq=67915 Ack=297 Win=64128 Len=1386 [TCP segment of a reassembled PDU]"
"143","1.157876","10.133.147.141","e1329.g.akamaiedge.net","TCP","40","49269  >  http(80) [ACK] Seq=297 Ack=69301 Win=223328 Len=0"
"144","1.158975","e1329.g.akamaiedge.net","10.133.147.141","TCP","1426","http(80)  >  49269 [ACK] Seq=69301 Ack=297 Win=64128 Len=1386 [TCP segment of a reassembled PDU]"
"145","1.159839","e1329.g.akamaiedge.net","10.133.147.141","TCP","1426","http(80)  >  49269 [PSH, ACK] Seq=70687 Ack=297 Win=64128 Len=1386 [TCP segment of a reassembled PDU]"
"146","1.160733","10.133.147.141","e1329.g.akamaiedge.net","TCP","40","49269  >  http(80) [ACK] Seq=297 Ack=72073 Win=220560 Len=0"
"147","1.161756","e1329.g.akamaiedge.net","10.133.147.141","TCP","1426","http(80)  >  49269 [ACK] Seq=72073 Ack=297 Win=64128 Len=1386 [TCP segment of a reassembled PDU]"
"148","1.162714","e1329.g.akamaiedge.net","10.133.147.141","TCP","1426","http(80)  >  49269 [PSH, ACK] Seq=73459 Ack=297 Win=64128 Len=1386 [TCP segment of a reassembled PDU]"
"149","1.163579","10.133.147.141","e1329.g.akamaiedge.net","TCP","40","49269  >  http(80) [ACK] Seq=297 Ack=74845 Win=217792 Len=0"
"150","1.164842","e1329.g.akamaiedge.net","10.133.147.141","TCP","1426","http(80)  >  49269 [ACK] Seq=74845 Ack=297 Win=64128 Len=1386 [TCP segment of a reassembled PDU]"
"151","1.165572","e1329.g.akamaiedge.net","10.133.147.141","TCP","1426","http(80)  >  49269 [PSH, ACK] Seq=76231 Ack=297 Win=64128 Len=1386 [TCP segment of a reassembled PDU]"
"152","1.166530","e1329.g.akamaiedge.net","10.133.147.141","TCP","1426","http(80)  >  49269 [ACK] Seq=77617 Ack=297 Win=64128 Len=1386 [TCP segment of a reassembled PDU]"
"153","1.167473","10.133.147.141","e1329.g.akamaiedge.net","TCP","40","49269  >  http(80) [ACK] Seq=297 Ack=77617 Win=215008 Len=0"
"154","1.168407","e1329.g.akamaiedge.net","10.133.147.141","TCP","1426","http(80)  >  49269 [PSH, ACK] Seq=79003 Ack=297 Win=64128 Len=1386 [TCP segment of a reassembled PDU]"
"155","1.169275","e1329.g.akamaiedge.net","10.133.147.141","TCP","1426","http(80)  >  49269 [ACK] Seq=80389 Ack=297 Win=64128 Len=1386 [TCP segment of a reassembled PDU]"
"156","1.170097","10.133.147.141","e1329.g.akamaiedge.net","TCP","40","49269  >  http(80) [ACK] Seq=297 Ack=80389 Win=212240 Len=0"
"157","1.170997","e1329.g.akamaiedge.net","10.133.147.141","TCP","1426","http(80)  >  49269 [PSH, ACK] Seq=81775 Ack=297 Win=64128 Len=1386 [TCP segment of a reassembled PDU]"
"158","1.172443","e1329.g.akamaiedge.net","10.133.147.141","TCP","1426","http(80)  >  49269 [ACK] Seq=83161 Ack=297 Win=64128 Len=1386 [TCP segment of a reassembled PDU]"
"159","1.173076","e1329.g.akamaiedge.net","10.133.147.141","TCP","1426","http(80)  >  49269 [PSH, ACK] Seq=84547 Ack=297 Win=64128 Len=1386 [TCP segment of a reassembled PDU]"
"160","1.174515","10.133.147.141","e1329.g.akamaiedge.net","TCP","40","49269  >  http(80) [ACK] Seq=297 Ack=83161 Win=209472 Len=0"
"161","1.175848","10.133.147.141","e1329.g.akamaiedge.net","TCP","40","49269  >  http(80) [ACK] Seq=297 Ack=85933 Win=206704 Len=0"
"162","1.176719","e1329.g.akamaiedge.net","10.133.147.141","TCP","1426","http(80)  >  49269 [ACK] Seq=85933 Ack=297 Win=64128 Len=1386 [TCP segment of a reassembled PDU]"
"163","1.177718","e1329.g.akamaiedge.net","10.133.147.141","TCP","1426","http(80)  >  49269 [PSH, ACK] Seq=87319 Ack=297 Win=64128 Len=1386 [TCP segment of a reassembled PDU]"
"164","1.178605","10.133.147.141","e1329.g.akamaiedge.net","TCP","40","49269  >  http(80) [ACK] Seq=297 Ack=88705 Win=203920 Len=0"
"165","1.180066","e1329.g.akamaiedge.net","10.133.147.141","TCP","1426","http(80)  >  49269 [ACK] Seq=88705 Ack=297 Win=64128 Len=1386 [TCP segment of a reassembled PDU]"
"166","1.180923","e1329.g.akamaiedge.net","10.133.147.141","TCP","1426","http(80)  >  49269 [PSH, ACK] Seq=90091 Ack=297 Win=64128 Len=1386 [TCP segment of a reassembled PDU]"
"167","1.181895","10.133.147.141","e1329.g.akamaiedge.net","TCP","40","49269  >  http(80) [ACK] Seq=297 Ack=91477 Win=201152 Len=0"
"168","1.182757","e1329.g.akamaiedge.net","10.133.147.141","TCP","1426","http(80)  >  49269 [ACK] Seq=91477 Ack=297 Win=64128 Len=1386 [TCP segment of a reassembled PDU]"
"169","1.183760","e1329.g.akamaiedge.net","10.133.147.141","TCP","135","http(80)  >  49269 [PSH, ACK] Seq=92863 Ack=297 Win=64128 Len=95 [TCP segment of a reassembled PDU]"
"170","1.184637","e1329.g.akamaiedge.net","10.133.147.141","TCP","1426","http(80)  >  49269 [ACK] Seq=92958 Ack=297 Win=64128 Len=1386 [TCP segment of a reassembled PDU]"
"171","1.185483","10.133.147.141","e1329.g.akamaiedge.net","TCP","40","49269  >  http(80) [ACK] Seq=297 Ack=92958 Win=199664 Len=0"
"172","1.186510","e1329.g.akamaiedge.net","10.133.147.141","HTTP/XML","694","HTTP/1.1 200 OK "
"173","1.187298","10.133.147.141","e1329.g.akamaiedge.net","TCP","40","49269  >  http(80) [ACK] Seq=297 Ack=94998 Win=197632 Len=0"
"174","1.188207","10.133.147.141","e1329.g.akamaiedge.net","TCP","40","[TCP Window Update] 49269  >  http(80) [ACK] Seq=297 Ack=94998 Win=232672 Len=0"
"175","1.189376","N/A","N/A","N/A","42","Raw packet data"
"176","1.190385","N/A","N/A","N/A","42","Raw packet data"
"177","1.191173","N/A","N/A","N/A","42","Raw packet data"
"178","1.192360","10.133.147.141","e1329.g.akamaiedge.net","TCP","40","[TCP Window Update] 49269  >  http(80) [ACK] Seq=297 Ack=94998 Win=262144 Len=0"
"179","1.193030","N/A","N/A","N/A","42","Raw packet data"
"180","1.193986","N/A","N/A","N/A","42","Raw packet data"
"181","1.194502","N/A","N/A","N/A","42","Raw packet data"
"182","1.195792","N/A","N/A","N/A","42","Raw packet data"
"183","1.196562","N/A","N/A","N/A","42","Raw packet data"
"184","1.197430","N/A","N/A","N/A","42","Raw packet data"
"185","1.198478","N/A","N/A","N/A","42","Raw packet data"
"186","1.199344","N/A","N/A","N/A","42","Raw packet data"
"187","1.200217","N/A","N/A","N/A","42","Raw packet data"
"188","2.203085","N/A","N/A","N/A","42","Raw packet data"
"189","2.203671","N/A","N/A","N/A","42","Raw packet data"
"190","2.203736","N/A","N/A","N/A","42","Raw packet data"
"191","2.204385","N/A","N/A","N/A","42","Raw packet data"
"192","2.204998","N/A","N/A","N/A","42","Raw packet data"
"193","2.205582","N/A","N/A","N/A","42","Raw packet data"
"194","2.206436","N/A","N/A","N/A","42","Raw packet data"
"195","2.210094","N/A","N/A","N/A","42","Raw packet data"
"196","2.210649","N/A","N/A","N/A","42","Raw packet data"
"197","2.211331","N/A","N/A","N/A","42","Raw packet data"
"198","2.211889","N/A","N/A","N/A","42","Raw packet data"
"199","2.212570","N/A","N/A","N/A","42","Raw packet data"
"200","2.212985","N/A","N/A","N/A","42","Raw packet data"
"201","2.213619","N/A","N/A","N/A","42","Raw packet data"
"202","2.214163","N/A","N/A","N/A","42","Raw packet data"
"203","2.215028","N/A","N/A","N/A","42","Raw packet data"
"204","2.219734","N/A","N/A","N/A","42","Raw packet data"
"205","2.220531","N/A","N/A","N/A","42","Raw packet data"
"206","2.220964","N/A","N/A","N/A","42","Raw packet data"
"207","2.221463","N/A","N/A","N/A","42","Raw packet data"
"208","2.221957","N/A","N/A","N/A","42","Raw packet data"
"209","2.222594","N/A","N/A","N/A","42","Raw packet data"
"210","2.223234","N/A","N/A","N/A","42","Raw packet data"
"211","2.229123","N/A","N/A","N/A","42","Raw packet data"
"212","2.230008","N/A","N/A","N/A","42","Raw packet data"
"213","2.230524","N/A","N/A","N/A","42","Raw packet data"
"214","2.230996","N/A","N/A","N/A","42","Raw packet data"
"215","2.231542","N/A","N/A","N/A","42","Raw packet data"
"216","2.232153","N/A","N/A","N/A","42","Raw packet data"
"217","2.232844","N/A","N/A","N/A","42","Raw packet data"
"218","2.236874","N/A","N/A","N/A","42","Raw packet data"
"219","3.238640","N/A","N/A","N/A","42","Raw packet data"
"220","3.239202","N/A","N/A","N/A","42","Raw packet data"
"221","3.240723","10.133.147.141","e1329.g.akamaiedge.net","TCP","40","49270  >  http(80) [FIN, ACK] Seq=1 Ack=1 Win=262144 Len=0"
"222","3.241587","10.133.147.141","e1329.g.akamaiedge.net","TCP","40","49269  >  http(80) [FIN, ACK] Seq=297 Ack=94998 Win=262144 Len=0"
"223","3.242287","e1329.g.akamaiedge.net","10.133.147.141","TCP","46","http(80)  >  49270 [FIN, ACK] Seq=1 Ack=2 Win=64256 Len=0"
"224","3.242810","10.133.147.141","e1329.g.akamaiedge.net","TCP","40","49270  >  http(80) [ACK] Seq=2 Ack=2 Win=262144 Len=0"
"225","3.243372","e1329.g.akamaiedge.net","10.133.147.141","TCP","46","http(80)  >  49269 [FIN, ACK] Seq=94998 Ack=298 Win=64128 Len=0"
"226","3.244020","10.133.147.141","e1329.g.akamaiedge.net","TCP","40","49269  >  http(80) [ACK] Seq=298 Ack=94999 Win=262144 Len=0"
"227","3.244566","10.133.147.141","e1329.g.akamaiedge.net","TCP","40","49268  >  http(80) [FIN, ACK] Seq=651 Ack=558 Win=16384 Len=0"
"228","3.245202","e1329.g.akamaiedge.net","10.133.147.141","TCP","46","http(80)  >  49268 [FIN, ACK] Seq=558 Ack=652 Win=501 Len=0"
"229","3.245755","10.133.147.141","e1329.g.akamaiedge.net","TCP","40","49268  >  http(80) [ACK] Seq=652 Ack=559 Win=16384 Len=0"
"230","3.250448","10.133.147.141","ocsp-a.g.aaplimg.com","TCP","64","49271  >  https(443) [SYN] Seq=0 Win=65535 Len=0 MSS=1460 WS=16 TSval=155125537 TSecr=0 SACK_PERM=1"
"231","3.251122","ocsp-a.g.aaplimg.com","10.133.147.141","TCP","52","https(443)  >  49271 [SYN, ACK] Seq=0 Ack=1 Win=64240 Len=0 MSS=1386 SACK_PERM=1 WS=256"
"232","3.251705","10.133.147.141","ocsp-a.g.aaplimg.com","TCP","40","49271  >  https(443) [ACK] Seq=1 Ack=1 Win=262144 Len=0"
"233","3.252090","10.133.147.141","ocsp-a.g.aaplimg.com","TLSv1.2","205","Client Hello"
"234","3.252648","ocsp-a.g.aaplimg.com","10.133.147.141","TCP","46","https(443)  >  49271 [ACK] Seq=1 Ack=166 Win=64256 Len=0"
"235","3.253217","ocsp-a.g.aaplimg.com","10.133.147.141","TLSv1.2","1426","Server Hello"
"236","3.253857","ocsp-a.g.aaplimg.com","10.133.147.141","TCP","1426","https(443)  >  49271 [ACK] Seq=1387 Ack=166 Win=64256 Len=1386 [TCP segment of a reassembled PDU]"
"237","3.257842","10.133.147.141","ocsp-a.g.aaplimg.com","TCP","40","49271  >  https(443) [ACK] Seq=166 Ack=2773 Win=259360 Len=0"
"238","3.258656","ocsp-a.g.aaplimg.com","10.133.147.141","TLSv1.2","1364","Certificate [TCP segment of a reassembled PDU]"
"239","3.259305","10.133.147.141","ocsp-a.g.aaplimg.com","TCP","40","49271  >  https(443) [ACK] Seq=166 Ack=4097 Win=258048 Len=0"
"240","3.260005","ocsp-a.g.aaplimg.com","10.133.147.141","TCP","1426","https(443)  >  49271 [ACK] Seq=4097 Ack=166 Win=64256 Len=1386 [TCP segment of a reassembled PDU]"
"241","3.260637","ocsp-a.g.aaplimg.com","10.133.147.141","TLSv1.2","976","Certificate Status, Server Key Exchange, Server Hello Done"
"242","3.261309","10.133.147.141","ocsp-a.g.aaplimg.com","TCP","40","49271  >  https(443) [ACK] Seq=166 Ack=6419 Win=255712 Len=0"
"243","3.261868","10.133.147.141","ocsp-a.g.aaplimg.com","TCP","40","[TCP Window Update] 49271  >  https(443) [ACK] Seq=166 Ack=6419 Win=262144 Len=0"
"244","3.262442","N/A","N/A","N/A","42","Raw packet data"
"245","3.263051","N/A","N/A","N/A","42","Raw packet data"
"246","3.263602","N/A","N/A","N/A","42","Raw packet data"
"247","3.265127","10.133.147.141","ocsp-a.g.aaplimg.com","TCP","64","49272  >  https(443) [SYN, ECN, CWR] Seq=0 Win=65535 Len=0 MSS=1460 WS=16 TSval=155125698 TSecr=0 SACK_PERM=1"
"248","3.266216","10.133.147.141","ns1.carleton.edu","DNS","59","Standard query 0xc3a0 A cds.apple.com"
"249","3.267207","ocsp-a.g.aaplimg.com","10.133.147.141","TCP","52","https(443)  >  49272 [SYN, ACK, ECN] Seq=0 Ack=1 Win=64240 Len=0 MSS=1386 SACK_PERM=1 WS=256"
"250","3.268210","ns1.carleton.edu","10.133.147.141","DNS","224","Standard query response 0xc3a0 A cds.apple.com CNAME cds-cdn.v.aaplimg.com CNAME cds.apple.com.akadns.net CNAME world-gen.g.aaplimg.com A 17.253.49.201 A 17.253.49.202 NS b.gslb.aaplimg.com NS a.gslb.aaplimg.com"
"251","3.269471","10.133.147.141","ocsp-a.g.aaplimg.com","TCP","40","49272  >  https(443) [ACK] Seq=1 Ack=1 Win=262144 Len=0"
"252","3.270148","10.133.147.141","ocsp-a.g.aaplimg.com","TCP","64","49273  >  https(443) [SYN] Seq=0 Win=65535 Len=0 MSS=1460 WS=16 TSval=155125727 TSecr=0 SACK_PERM=1"
"253","3.270996","ocsp-a.g.aaplimg.com","10.133.147.141","TCP","52","https(443)  >  49273 [SYN, ACK] Seq=0 Ack=1 Win=64240 Len=0 MSS=1386 SACK_PERM=1 WS=256"
"254","3.271873","10.133.147.141","ocsp-a.g.aaplimg.com","TCP","40","49273  >  https(443) [ACK] Seq=1 Ack=1 Win=262144 Len=0"
"255","3.273255","N/A","N/A","N/A","42","Raw packet data"
"256","3.274172","10.133.147.141","ocsp-a.g.aaplimg.com","TLSv1.2","205","Client Hello"
"257","3.275813","10.133.147.141","ocsp-a.g.aaplimg.com","TLSv1.2","205","Client Hello"
"258","3.276523","ocsp-a.g.aaplimg.com","10.133.147.141","TCP","46","https(443)  >  49272 [ACK] Seq=1 Ack=166 Win=64256 Len=0"
"259","3.277497","ocsp-a.g.aaplimg.com","10.133.147.141","TLSv1.2","1426","Server Hello"
"260","3.278448","ocsp-a.g.aaplimg.com","10.133.147.141","TCP","1426","https(443)  >  49272 [ACK] Seq=1387 Ack=166 Win=64256 Len=1386 [TCP segment of a reassembled PDU]"
"261","3.279357","10.133.147.141","ocsp-a.g.aaplimg.com","TCP","40","49272  >  https(443) [ACK] Seq=166 Ack=2773 Win=259360 Len=0"
"262","3.280367","ocsp-a.g.aaplimg.com","10.133.147.141","TLSv1.2","1364","Certificate [TCP segment of a reassembled PDU]"
"263","3.281325","10.133.147.141","ocsp-a.g.aaplimg.com","TCP","40","49272  >  https(443) [ACK] Seq=166 Ack=4097 Win=258048 Len=0"
"264","3.282170","10.133.147.141","ocsp-a.g.aaplimg.com","TCP","40","[TCP Window Update] 49272  >  https(443) [ACK] Seq=166 Ack=4097 Win=262144 Len=0"
"265","3.283134","ocsp-a.g.aaplimg.com","10.133.147.141","TCP","1426","https(443)  >  49272 [ACK] Seq=4097 Ack=166 Win=64256 Len=1386 [TCP segment of a reassembled PDU]"
"266","3.283996","ocsp-a.g.aaplimg.com","10.133.147.141","TLSv1.2","976","Certificate Status, Server Key Exchange, Server Hello Done"
"267","3.284838","10.133.147.141","ocsp-a.g.aaplimg.com","TCP","40","49272  >  https(443) [ACK] Seq=166 Ack=6419 Win=259808 Len=0"
"268","3.285750","ocsp-a.g.aaplimg.com","10.133.147.141","TCP","46","https(443)  >  49273 [ACK] Seq=1 Ack=166 Win=64256 Len=0"
"269","3.286710","ocsp-a.g.aaplimg.com","10.133.147.141","TLSv1.2","1426","Server Hello"
"270","3.287560","ocsp-a.g.aaplimg.com","10.133.147.141","TCP","1426","https(443)  >  49273 [ACK] Seq=1387 Ack=166 Win=64256 Len=1386 [TCP segment of a reassembled PDU]"
"271","3.288462","10.133.147.141","ocsp-a.g.aaplimg.com","TCP","40","49273  >  https(443) [ACK] Seq=166 Ack=2773 Win=259360 Len=0"
"272","3.289349","10.133.147.141","ocsp-a.g.aaplimg.com","TCP","40","[TCP Window Update] 49273  >  https(443) [ACK] Seq=166 Ack=2773 Win=262144 Len=0"
"273","3.290338","ocsp-a.g.aaplimg.com","10.133.147.141","TLSv1.2","1364","Certificate [TCP segment of a reassembled PDU]"
"274","3.291277","ocsp-a.g.aaplimg.com","10.133.147.141","TLSv1.2","732","Certificate Status, Server Key Exchange, Server Hello Done"
"275","3.292511","10.133.147.141","ocsp-a.g.aaplimg.com","TCP","40","49273  >  https(443) [ACK] Seq=166 Ack=4097 Win=260816 Len=0"
"276","3.293294","10.133.147.141","ocsp-a.g.aaplimg.com","TCP","40","49273  >  https(443) [ACK] Seq=166 Ack=4789 Win=260128 Len=0"
"277","3.294258","N/A","N/A","N/A","42","Raw packet data"
"278","3.295174","N/A","N/A","N/A","42","Raw packet data"
"279","3.296169","N/A","N/A","N/A","42","Raw packet data"
"280","3.297087","N/A","N/A","N/A","42","Raw packet data"
"281","3.298002","N/A","N/A","N/A","42","Raw packet data"
"282","3.298915","N/A","N/A","N/A","42","Raw packet data"
"283","3.299774","N/A","N/A","N/A","42","Raw packet data"
"284","3.300635","N/A","N/A","N/A","42","Raw packet data"
"285","3.301611","N/A","N/A","N/A","42","Raw packet data"
"286","3.302547","N/A","N/A","N/A","42","Raw packet data"
"287","3.303488","10.133.147.141","ocsp-a.g.aaplimg.com","TLSv1.2","115","Client Key Exchange"
"288","3.304499","10.133.147.141","ocsp-a.g.aaplimg.com","TLSv1.2","46","Change Cipher Spec"
"289","3.305597","10.133.147.141","ocsp-a.g.aaplimg.com","TLSv1.2","85","Encrypted Handshake Message"
"290","3.306368","ocsp-a.g.aaplimg.com","10.133.147.141","TCP","46","https(443)  >  49273 [ACK] Seq=4789 Ack=292 Win=64256 Len=0"
"291","3.307288","ocsp-a.g.aaplimg.com","10.133.147.141","TLSv1.2","91","Change Cipher Spec, Encrypted Handshake Message"
"292","3.308086","10.133.147.141","ocsp-a.g.aaplimg.com","TCP","40","49273  >  https(443) [ACK] Seq=292 Ack=4840 Win=262080 Len=0"
"293","3.309229","N/A","N/A","N/A","42","Raw packet data"
"294","4.312665","N/A","N/A","N/A","42","Raw packet data"
"295","4.313504","N/A","N/A","N/A","42","Raw packet data"
"296","4.314232","N/A","N/A","N/A","42","Raw packet data"
"297","4.315037","N/A","N/A","N/A","42","Raw packet data"
"298","4.316054","N/A","N/A","N/A","42","Raw packet data"
"299","4.316738","10.133.147.141","ocsp-a.g.aaplimg.com","TLSv1.2","331","Application Data"
"300","4.317453","ocsp-a.g.aaplimg.com","10.133.147.141","TLSv1.2","747","Application Data"
"301","4.322285","ocsp-a.g.aaplimg.com","10.133.147.141","TCP","1426","https(443)  >  49273 [ACK] Seq=5547 Ack=583 Win=64256 Len=1386 [TCP segment of a reassembled PDU]"
"302","4.323201","10.133.147.141","ocsp-a.g.aaplimg.com","TCP","40","49273  >  https(443) [ACK] Seq=583 Ack=5547 Win=261424 Len=0"
"303","4.324329","ocsp-a.g.aaplimg.com","10.133.147.141","TCP","1426","https(443)  >  49273 [ACK] Seq=6933 Ack=583 Win=64256 Len=1386 [TCP segment of a reassembled PDU]"
"304","4.325101","ocsp-a.g.aaplimg.com","10.133.147.141","TCP","1426","https(443)  >  49273 [ACK] Seq=8319 Ack=583 Win=64256 Len=1386 [TCP segment of a reassembled PDU]"
"305","4.325792","ocsp-a.g.aaplimg.com","10.133.147.141","TCP","1426","https(443)  >  49273 [ACK] Seq=9705 Ack=583 Win=64256 Len=1386 [TCP segment of a reassembled PDU]"
"306","4.326771","10.133.147.141","ocsp-a.g.aaplimg.com","TCP","40","49273  >  https(443) [ACK] Seq=583 Ack=8319 Win=258656 Len=0"
"307","4.327267","10.133.147.141","ocsp-a.g.aaplimg.com","TCP","40","49273  >  https(443) [ACK] Seq=583 Ack=11091 Win=255888 Len=0"
"308","4.334077","ocsp-a.g.aaplimg.com","10.133.147.141","TCP","1426","https(443)  >  49273 [ACK] Seq=11091 Ack=583 Win=64256 Len=1386 [TCP segment of a reassembled PDU]"
"309","4.334894","ocsp-a.g.aaplimg.com","10.133.147.141","TCP","1426","https(443)  >  49273 [ACK] Seq=12477 Ack=583 Win=64256 Len=1386 [TCP segment of a reassembled PDU]"
"310","4.335568","ocsp-a.g.aaplimg.com","10.133.147.141","TCP","1426","https(443)  >  49273 [ACK] Seq=13863 Ack=583 Win=64256 Len=1386 [TCP segment of a reassembled PDU]"
"311","4.336172","ocsp-a.g.aaplimg.com","10.133.147.141","TCP","1426","https(443)  >  49273 [ACK] Seq=15249 Ack=583 Win=64256 Len=1386 [TCP segment of a reassembled PDU]"
"312","4.337014","10.133.147.141","ocsp-a.g.aaplimg.com","TCP","40","49273  >  https(443) [ACK] Seq=583 Ack=13863 Win=253120 Len=0"
"313","4.337542","10.133.147.141","ocsp-a.g.aaplimg.com","TCP","40","49273  >  https(443) [ACK] Seq=583 Ack=16635 Win=250336 Len=0"
"314","4.338192","ocsp-a.g.aaplimg.com","10.133.147.141","TCP","1426","https(443)  >  49273 [ACK] Seq=16635 Ack=583 Win=64256 Len=1386 [TCP segment of a reassembled PDU]"
"315","4.338889","ocsp-a.g.aaplimg.com","10.133.147.141","TCP","1426","https(443)  >  49273 [ACK] Seq=18021 Ack=583 Win=64256 Len=1386 [TCP segment of a reassembled PDU]"
"316","4.339388","10.133.147.141","ocsp-a.g.aaplimg.com","TCP","40","49273  >  https(443) [ACK] Seq=583 Ack=19407 Win=247568 Len=0"
"317","4.340237","ocsp-a.g.aaplimg.com","10.133.147.141","TCP","1426","https(443)  >  49273 [ACK] Seq=19407 Ack=583 Win=64256 Len=1386 [TCP segment of a reassembled PDU]"
"318","4.341358","ocsp-a.g.aaplimg.com","10.133.147.141","TLSv1.2","1426","Application Data [TCP segment of a reassembled PDU]"
"319","4.342307","10.133.147.141","ocsp-a.g.aaplimg.com","TCP","40","49273  >  https(443) [ACK] Seq=583 Ack=22179 Win=244800 Len=0"
"320","4.343251","ocsp-a.g.aaplimg.com","10.133.147.141","TCP","1426","https(443)  >  49273 [ACK] Seq=22179 Ack=583 Win=64256 Len=1386 [TCP segment of a reassembled PDU]"
"321","4.344256","ocsp-a.g.aaplimg.com","10.133.147.141","TCP","1426","https(443)  >  49273 [ACK] Seq=23565 Ack=583 Win=64256 Len=1386 [TCP segment of a reassembled PDU]"
"322","4.345109","10.133.147.141","ocsp-a.g.aaplimg.com","TCP","40","49273  >  https(443) [ACK] Seq=583 Ack=24951 Win=242032 Len=0"
"323","4.353279","ocsp-a.g.aaplimg.com","10.133.147.141","TCP","1426","https(443)  >  49273 [ACK] Seq=24951 Ack=583 Win=64256 Len=1386 [TCP segment of a reassembled PDU]"
"324","4.354351","ocsp-a.g.aaplimg.com","10.133.147.141","TCP","1426","https(443)  >  49273 [ACK] Seq=26337 Ack=583 Win=64256 Len=1386 [TCP segment of a reassembled PDU]"
"325","4.355008","ocsp-a.g.aaplimg.com","10.133.147.141","TCP","1426","https(443)  >  49273 [ACK] Seq=27723 Ack=583 Win=64256 Len=1386 [TCP segment of a reassembled PDU]"
"326","4.355823","10.133.147.141","ocsp-a.g.aaplimg.com","TCP","40","49273  >  https(443) [ACK] Seq=583 Ack=27723 Win=239248 Len=0"
"327","4.356472","ocsp-a.g.aaplimg.com","10.133.147.141","TCP","1426","https(443)  >  49273 [ACK] Seq=29109 Ack=583 Win=64256 Len=1386 [TCP segment of a reassembled PDU]"
"328","4.357579","10.133.147.141","ocsp-a.g.aaplimg.com","TCP","40","49273  >  https(443) [ACK] Seq=583 Ack=30495 Win=236480 Len=0"
"329","4.358221","ocsp-a.g.aaplimg.com","10.133.147.141","TCP","1426","https(443)  >  49273 [ACK] Seq=30495 Ack=583 Win=64256 Len=1386 [TCP segment of a reassembled PDU]"
"330","4.362784","ocsp-a.g.aaplimg.com","10.133.147.141","TCP","1426","https(443)  >  49273 [ACK] Seq=31881 Ack=583 Win=64256 Len=1386 [TCP segment of a reassembled PDU]"
"331","4.363448","10.133.147.141","ocsp-a.g.aaplimg.com","TCP","40","49273  >  https(443) [ACK] Seq=583 Ack=33267 Win=233712 Len=0"
"332","4.364197","ocsp-a.g.aaplimg.com","10.133.147.141","TCP","1426","https(443)  >  49273 [ACK] Seq=33267 Ack=583 Win=64256 Len=1386 [TCP segment of a reassembled PDU]"
"333","4.364920","ocsp-a.g.aaplimg.com","10.133.147.141","TCP","1426","https(443)  >  49273 [ACK] Seq=34653 Ack=583 Win=64256 Len=1386 [TCP segment of a reassembled PDU]"
