"No.","Time","Source","Destination","Protocol","Length","Info"
"1","0.000000","usmes2-vip-bx-001.aaplimg.com","10.133.147.141","TCP","1426","http(80)  >  49961 [ACK] Seq=1 Ack=1 Win=251 Len=1386"
"2","0.000644","usmes2-vip-bx-001.aaplimg.com","10.133.147.141","TCP","1426","http(80)  >  49961 [ACK] Seq=1387 Ack=1 Win=251 Len=1386"
"3","0.001702","10.133.147.141","usmes2-vip-bx-001.aaplimg.com","TCP","40","49961  >  http(80) [ACK] Seq=1 Ack=2773 Win=8923 Len=0"
"4","0.003182","usmes2-vip-bx-001.aaplimg.com","10.133.147.141","TCP","1426","http(80)  >  49961 [ACK] Seq=2773 Ack=1 Win=251 Len=1386"
"5","0.004172","usmes2-vip-bx-001.aaplimg.com","10.133.147.141","TCP","1426","http(80)  >  49961 [ACK] Seq=4159 Ack=1 Win=251 Len=1386"
"6","0.007635","10.133.147.141","usmes2-vip-bx-001.aaplimg.com","TCP","40","49961  >  http(80) [ACK] Seq=1 Ack=5545 Win=8750 Len=0"
"7","0.007652","usmes2-vip-bx-001.aaplimg.com","10.133.147.141","TCP","1426","http(80)  >  49961 [ACK] Seq=5545 Ack=1 Win=251 Len=1386"
"8","0.009881","usmes2-vip-bx-001.aaplimg.com","10.133.147.141","TCP","1426","http(80)  >  49961 [ACK] Seq=6931 Ack=1 Win=251 Len=1386"
"9","0.010846","10.133.147.141","usmes2-vip-bx-001.aaplimg.com","TCP","40","49961  >  http(80) [ACK] Seq=1 Ack=8317 Win=8577 Len=0"
"10","0.011927","usmes2-vip-bx-001.aaplimg.com","10.133.147.141","TCP","1426","http(80)  >  49961 [ACK] Seq=8317 Ack=1 Win=251 Len=1386"
"11","0.012802","usmes2-vip-bx-001.aaplimg.com","10.133.147.141","TCP","1426","http(80)  >  49961 [ACK] Seq=9703 Ack=1 Win=251 Len=1386"
"12","0.015078","10.133.147.141","usmes2-vip-bx-001.aaplimg.com","TCP","40","49961  >  http(80) [ACK] Seq=1 Ack=11089 Win=8403 Len=0"
"13","0.016610","usmes2-vip-bx-001.aaplimg.com","10.133.147.141","TCP","1426","http(80)  >  49961 [ACK] Seq=11089 Ack=1 Win=251 Len=1386"
"14","0.017279","usmes2-vip-bx-001.aaplimg.com","10.133.147.141","TCP","1426","http(80)  >  49961 [ACK] Seq=12475 Ack=1 Win=251 Len=1386"
"15","0.018093","usmes2-vip-bx-001.aaplimg.com","10.133.147.141","TCP","1426","http(80)  >  49961 [ACK] Seq=13861 Ack=1 Win=251 Len=1386"
"16","0.018966","10.133.147.141","usmes2-vip-bx-001.aaplimg.com","TCP","40","49961  >  http(80) [ACK] Seq=1 Ack=13861 Win=8230 Len=0"
"17","0.020840","usmes2-vip-bx-001.aaplimg.com","10.133.147.141","TCP","1426","http(80)  >  49961 [ACK] Seq=15247 Ack=1 Win=251 Len=1386"
"18","0.021451","usmes2-vip-bx-001.aaplimg.com","10.133.147.141","TCP","1426","http(80)  >  49961 [ACK] Seq=16633 Ack=1 Win=251 Len=1386"
"19","0.022408","10.133.147.141","usmes2-vip-bx-001.aaplimg.com","TCP","40","49961  >  http(80) [ACK] Seq=1 Ack=16633 Win=8057 Len=0"
"20","0.023864","usmes2-vip-bx-001.aaplimg.com","10.133.147.141","TCP","1426","http(80)  >  49961 [ACK] Seq=18019 Ack=1 Win=251 Len=1386"
"21","0.025733","usmes2-vip-bx-001.aaplimg.com","10.133.147.141","TCP","1426","http(80)  >  49961 [ACK] Seq=19405 Ack=1 Win=251 Len=1386"
"22","0.027984","usmes2-vip-bx-001.aaplimg.com","10.133.147.141","TCP","1426","http(80)  >  49961 [ACK] Seq=20791 Ack=1 Win=251 Len=1386"
"23","0.029204","10.133.147.141","usmes2-vip-bx-001.aaplimg.com","TCP","40","49961  >  http(80) [ACK] Seq=1 Ack=19405 Win=7884 Len=0"
"24","0.030151","10.133.147.141","usmes2-vip-bx-001.aaplimg.com","TCP","40","49961  >  http(80) [ACK] Seq=1 Ack=22177 Win=7710 Len=0"
"25","0.031094","usmes2-vip-bx-001.aaplimg.com","10.133.147.141","TCP","1426","http(80)  >  49961 [ACK] Seq=22177 Ack=1 Win=251 Len=1386"
"26","0.033135","usmes2-vip-bx-001.aaplimg.com","10.133.147.141","TCP","1426","http(80)  >  49961 [ACK] Seq=23563 Ack=1 Win=251 Len=1386"
"27","0.033861","10.133.147.141","usmes2-vip-bx-001.aaplimg.com","TCP","40","49961  >  http(80) [ACK] Seq=1 Ack=24949 Win=7537 Len=0"
"28","0.035573","N/A","N/A","N/A","42","Raw packet data"
"29","0.036221","usmes2-vip-bx-001.aaplimg.com","10.133.147.141","TCP","1426","http(80)  >  49961 [ACK] Seq=24949 Ack=1 Win=251 Len=1386"
"30","0.037600","usmes2-vip-bx-001.aaplimg.com","10.133.147.141","TCP","1426","http(80)  >  49961 [ACK] Seq=26335 Ack=1 Win=251 Len=1386"
"31","0.038503","usmes2-vip-bx-001.aaplimg.com","10.133.147.141","TCP","1426","http(80)  >  49961 [ACK] Seq=27721 Ack=1 Win=251 Len=1386"
"32","0.039315","10.133.147.141","usmes2-vip-bx-001.aaplimg.com","TCP","40","49961  >  http(80) [ACK] Seq=1 Ack=27721 Win=7364 Len=0"
"33","0.040934","usmes2-vip-bx-001.aaplimg.com","10.133.147.141","TCP","1426","http(80)  >  49961 [ACK] Seq=29107 Ack=1 Win=251 Len=1386"
"34","0.042199","usmes2-vip-bx-001.aaplimg.com","10.133.147.141","TCP","1426","http(80)  >  49961 [ACK] Seq=30493 Ack=1 Win=251 Len=1386"
"35","0.042884","10.133.147.141","usmes2-vip-bx-001.aaplimg.com","TCP","40","49961  >  http(80) [ACK] Seq=1 Ack=30493 Win=7191 Len=0"
"36","0.044090","usmes2-vip-bx-001.aaplimg.com","10.133.147.141","TCP","1426","http(80)  >  49961 [ACK] Seq=31879 Ack=1 Win=251 Len=1386"
"37","0.044741","usmes2-vip-bx-001.aaplimg.com","10.133.147.141","TCP","1426","http(80)  >  49961 [ACK] Seq=33265 Ack=1 Win=251 Len=1386"
"38","0.045710","10.133.147.141","usmes2-vip-bx-001.aaplimg.com","TCP","40","49961  >  http(80) [ACK] Seq=1 Ack=33265 Win=7017 Len=0"
"39","0.046856","usmes2-vip-bx-001.aaplimg.com","10.133.147.141","TCP","1426","http(80)  >  49961 [ACK] Seq=34651 Ack=1 Win=251 Len=1386"
"40","0.047500","10.133.147.141","usmes2-vip-bx-001.aaplimg.com","TCP","40","49961  >  http(80) [ACK] Seq=1 Ack=36037 Win=6844 Len=0"
"41","0.049533","usmes2-vip-bx-001.aaplimg.com","10.133.147.141","TCP","1426","http(80)  >  49961 [ACK] Seq=36037 Ack=1 Win=251 Len=1386"
"42","0.050230","usmes2-vip-bx-001.aaplimg.com","10.133.147.141","TCP","1426","http(80)  >  49961 [ACK] Seq=37423 Ack=1 Win=251 Len=1386"
"43","0.051039","10.133.147.141","usmes2-vip-bx-001.aaplimg.com","TCP","40","49961  >  http(80) [ACK] Seq=1 Ack=38809 Win=6671 Len=0"
"44","0.052279","usmes2-vip-bx-001.aaplimg.com","10.133.147.141","TCP","1426","http(80)  >  49961 [ACK] Seq=38809 Ack=1 Win=251 Len=1386"
"45","0.053272","usmes2-vip-bx-001.aaplimg.com","10.133.147.141","TCP","1426","http(80)  >  49961 [ACK] Seq=40195 Ack=1 Win=251 Len=1386"
"46","0.053999","usmes2-vip-bx-001.aaplimg.com","10.133.147.141","TCP","1426","http(80)  >  49961 [ACK] Seq=41581 Ack=1 Win=251 Len=1386"
"47","0.055822","10.133.147.141","usmes2-vip-bx-001.aaplimg.com","TCP","40","49961  >  http(80) [ACK] Seq=1 Ack=41581 Win=6498 Len=0"
"48","0.056435","usmes2-vip-bx-001.aaplimg.com","10.133.147.141","TCP","1426","http(80)  >  49961 [ACK] Seq=42967 Ack=1 Win=251 Len=1386"
"49","0.057296","10.133.147.141","usmes2-vip-bx-001.aaplimg.com","TCP","40","49961  >  http(80) [ACK] Seq=1 Ack=44353 Win=6324 Len=0"
"50","0.059459","usmes2-vip-bx-001.aaplimg.com","10.133.147.141","TCP","1426","http(80)  >  49961 [ACK] Seq=44353 Ack=1 Win=251 Len=1386"
"51","0.060311","usmes2-vip-bx-001.aaplimg.com","10.133.147.141","TCP","1426","http(80)  >  49961 [ACK] Seq=45739 Ack=1 Win=251 Len=1386"
"52","0.061372","10.133.147.141","usmes2-vip-bx-001.aaplimg.com","TCP","40","49961  >  http(80) [ACK] Seq=1 Ack=47125 Win=6151 Len=0"
"53","0.062406","usmes2-vip-bx-001.aaplimg.com","10.133.147.141","TCP","1426","http(80)  >  49961 [ACK] Seq=47125 Ack=1 Win=251 Len=1386"
"54","0.063252","usmes2-vip-bx-001.aaplimg.com","10.133.147.141","TCP","1426","http(80)  >  49961 [ACK] Seq=48511 Ack=1 Win=251 Len=1386"
"55","0.064155","usmes2-vip-bx-001.aaplimg.com","10.133.147.141","TCP","1426","http(80)  >  49961 [ACK] Seq=49897 Ack=1 Win=251 Len=1386"
"56","0.064882","10.133.147.141","usmes2-vip-bx-001.aaplimg.com","TCP","40","49961  >  http(80) [ACK] Seq=1 Ack=49897 Win=5978 Len=0"
"57","0.065779","usmes2-vip-bx-001.aaplimg.com","10.133.147.141","TCP","1426","http(80)  >  49961 [ACK] Seq=51283 Ack=1 Win=251 Len=1386"
"58","0.067417","10.133.147.141","usmes2-vip-bx-001.aaplimg.com","TCP","40","49961  >  http(80) [ACK] Seq=1 Ack=52669 Win=5805 Len=0"
"59","0.068195","N/A","N/A","N/A","42","Raw packet data"
"60","0.069100","N/A","N/A","N/A","42","Raw packet data"
"61","0.070527","usmes2-vip-bx-001.aaplimg.com","10.133.147.141","TCP","1426","http(80)  >  49961 [ACK] Seq=52669 Ack=1 Win=251 Len=1386"
"62","0.071459","usmes2-vip-bx-001.aaplimg.com","10.133.147.141","TCP","1426","http(80)  >  49961 [ACK] Seq=54055 Ack=1 Win=251 Len=1386"
"63","0.072293","usmes2-vip-bx-001.aaplimg.com","10.133.147.141","TCP","1426","http(80)  >  49961 [ACK] Seq=55441 Ack=1 Win=251 Len=1386"
"64","0.073486","10.133.147.141","usmes2-vip-bx-001.aaplimg.com","TCP","40","49961  >  http(80) [ACK] Seq=1 Ack=55441 Win=5631 Len=0"
"65","0.075181","usmes2-vip-bx-001.aaplimg.com","10.133.147.141","TCP","1426","http(80)  >  49961 [ACK] Seq=56827 Ack=1 Win=251 Len=1386"
"66","0.075826","usmes2-vip-bx-001.aaplimg.com","10.133.147.141","TCP","1426","http(80)  >  49961 [ACK] Seq=58213 Ack=1 Win=251 Len=1386"
"67","0.077485","usmes2-vip-bx-001.aaplimg.com","10.133.147.141","TCP","1426","http(80)  >  49961 [ACK] Seq=59599 Ack=1 Win=251 Len=1386"
"68","0.078506","10.133.147.141","usmes2-vip-bx-001.aaplimg.com","TCP","40","49961  >  http(80) [ACK] Seq=1 Ack=58213 Win=5458 Len=0"
"69","0.078517","10.133.147.141","usmes2-vip-bx-001.aaplimg.com","TCP","40","49961  >  http(80) [ACK] Seq=1 Ack=60985 Win=5285 Len=0"
"70","0.080554","usmes2-vip-bx-001.aaplimg.com","10.133.147.141","TCP","1426","http(80)  >  49961 [ACK] Seq=60985 Ack=1 Win=251 Len=1386"
"71","0.081491","usmes2-vip-bx-001.aaplimg.com","10.133.147.141","TCP","1426","http(80)  >  49961 [ACK] Seq=62371 Ack=1 Win=251 Len=1386"
"72","0.082833","10.133.147.141","usmes2-vip-bx-001.aaplimg.com","TCP","40","49961  >  http(80) [ACK] Seq=1 Ack=63757 Win=5112 Len=0"
"73","0.083574","usmes2-vip-bx-001.aaplimg.com","10.133.147.141","TCP","1426","http(80)  >  49961 [ACK] Seq=63757 Ack=1 Win=251 Len=1386"
"74","0.084824","usmes2-vip-bx-001.aaplimg.com","10.133.147.141","TCP","1426","http(80)  >  49961 [ACK] Seq=65143 Ack=1 Win=251 Len=1386"
"75","0.085982","usmes2-vip-bx-001.aaplimg.com","10.133.147.141","TCP","1426","http(80)  >  49961 [ACK] Seq=66529 Ack=1 Win=251 Len=1386"
"76","0.087027","usmes2-vip-bx-001.aaplimg.com","10.133.147.141","TCP","1426","http(80)  >  49961 [ACK] Seq=67915 Ack=1 Win=251 Len=1386"
"77","0.087847","10.133.147.141","usmes2-vip-bx-001.aaplimg.com","TCP","40","49961  >  http(80) [ACK] Seq=1 Ack=66529 Win=4938 Len=0"
"78","0.088695","10.133.147.141","usmes2-vip-bx-001.aaplimg.com","TCP","40","49961  >  http(80) [ACK] Seq=1 Ack=69301 Win=4765 Len=0"
"79","0.090169","usmes2-vip-bx-001.aaplimg.com","10.133.147.141","TCP","1426","http(80)  >  49961 [ACK] Seq=69301 Ack=1 Win=251 Len=1386"
"80","0.091355","usmes2-vip-bx-001.aaplimg.com","10.133.147.141","TCP","1426","http(80)  >  49961 [ACK] Seq=70687 Ack=1 Win=251 Len=1386"
"81","0.092251","usmes2-vip-bx-001.aaplimg.com","10.133.147.141","TCP","1426","http(80)  >  49961 [ACK] Seq=72073 Ack=1 Win=251 Len=1386"
"82","0.093410","10.133.147.141","usmes2-vip-bx-001.aaplimg.com","TCP","40","49961  >  http(80) [ACK] Seq=1 Ack=72073 Win=4592 Len=0"
"83","0.094302","usmes2-vip-bx-001.aaplimg.com","10.133.147.141","TCP","1426","http(80)  >  49961 [ACK] Seq=73459 Ack=1 Win=251 Len=1386"
"84","0.095555","10.133.147.141","usmes2-vip-bx-001.aaplimg.com","TCP","40","49961  >  http(80) [ACK] Seq=1 Ack=74845 Win=4419 Len=0"
"85","0.096552","usmes2-vip-bx-001.aaplimg.com","10.133.147.141","TCP","1426","http(80)  >  49961 [ACK] Seq=74845 Ack=1 Win=251 Len=1386"
"86","0.097301","usmes2-vip-bx-001.aaplimg.com","10.133.147.141","TCP","1426","http(80)  >  49961 [ACK] Seq=76231 Ack=1 Win=251 Len=1386"
"87","0.098908","10.133.147.141","usmes2-vip-bx-001.aaplimg.com","TCP","40","49961  >  http(80) [ACK] Seq=1 Ack=77617 Win=4245 Len=0"
"88","0.100572","usmes2-vip-bx-001.aaplimg.com","10.133.147.141","TCP","1426","http(80)  >  49961 [ACK] Seq=77617 Ack=1 Win=251 Len=1386"
"89","0.101447","usmes2-vip-bx-001.aaplimg.com","10.133.147.141","TCP","1426","http(80)  >  49961 [ACK] Seq=79003 Ack=1 Win=251 Len=1386"
"90","0.102322","usmes2-vip-bx-001.aaplimg.com","10.133.147.141","TCP","1426","http(80)  >  49961 [ACK] Seq=80389 Ack=1 Win=251 Len=1386"
"91","0.103722","10.133.147.141","usmes2-vip-bx-001.aaplimg.com","TCP","40","49961  >  http(80) [ACK] Seq=1 Ack=80389 Win=4072 Len=0"
"92","0.104625","usmes2-vip-bx-001.aaplimg.com","10.133.147.141","TCP","1426","http(80)  >  49961 [ACK] Seq=81775 Ack=1 Win=251 Len=1386"
"93","0.105346","10.133.147.141","usmes2-vip-bx-001.aaplimg.com","TCP","40","49961  >  http(80) [ACK] Seq=1 Ack=83161 Win=3899 Len=0"
"94","0.107063","usmes2-vip-bx-001.aaplimg.com","10.133.147.141","TCP","1426","http(80)  >  49961 [ACK] Seq=83161 Ack=1 Win=251 Len=1386"
"95","0.108771","usmes2-vip-bx-001.aaplimg.com","10.133.147.141","TCP","1426","http(80)  >  49961 [ACK] Seq=84547 Ack=1 Win=251 Len=1386"
"96","0.110394","usmes2-vip-bx-001.aaplimg.com","10.133.147.141","TCP","1426","http(80)  >  49961 [ACK] Seq=85933 Ack=1 Win=251 Len=1386"
"97","0.110966","10.133.147.141","usmes2-vip-bx-001.aaplimg.com","TCP","40","49961  >  http(80) [ACK] Seq=1 Ack=85933 Win=3726 Len=0"
"98","0.111992","usmes2-vip-bx-001.aaplimg.com","10.133.147.141","TCP","1426","http(80)  >  49961 [ACK] Seq=87319 Ack=1 Win=251 Len=1386"
"99","0.113722","usmes2-vip-bx-001.aaplimg.com","10.133.147.141","TCP","1426","http(80)  >  49961 [ACK] Seq=88705 Ack=1 Win=251 Len=1386"
"100","0.114257","10.133.147.141","usmes2-vip-bx-001.aaplimg.com","TCP","40","49961  >  http(80) [ACK] Seq=1 Ack=88705 Win=3552 Len=0"
"101","0.115280","usmes2-vip-bx-001.aaplimg.com","10.133.147.141","TCP","1426","http(80)  >  49961 [ACK] Seq=90091 Ack=1 Win=251 Len=1386"
"102","0.117132","usmes2-vip-bx-001.aaplimg.com","10.133.147.141","TCP","1426","http(80)  >  49961 [ACK] Seq=91477 Ack=1 Win=251 Len=1386"
"103","0.118279","usmes2-vip-bx-001.aaplimg.com","10.133.147.141","TCP","1426","http(80)  >  49961 [ACK] Seq=92863 Ack=1 Win=251 Len=1386"
"104","0.118290","10.133.147.141","usmes2-vip-bx-001.aaplimg.com","TCP","40","49961  >  http(80) [ACK] Seq=1 Ack=91477 Win=3379 Len=0"
"105","0.119651","10.133.147.141","usmes2-vip-bx-001.aaplimg.com","TCP","40","49961  >  http(80) [ACK] Seq=1 Ack=94249 Win=3206 Len=0"
"106","0.120742","usmes2-vip-bx-001.aaplimg.com","10.133.147.141","TCP","1426","http(80)  >  49961 [ACK] Seq=94249 Ack=1 Win=251 Len=1386"
"107","0.122167","usmes2-vip-bx-001.aaplimg.com","10.133.147.141","TCP","1426","http(80)  >  49961 [ACK] Seq=95635 Ack=1 Win=251 Len=1386"
"108","0.123127","10.133.147.141","usmes2-vip-bx-001.aaplimg.com","TCP","40","49961  >  http(80) [ACK] Seq=1 Ack=97021 Win=3033 Len=0"
"109","0.123776","N/A","N/A","N/A","42","Raw packet data"
"110","0.126630","N/A","N/A","N/A","42","Raw packet data"
"111","0.127673","usmes2-vip-bx-001.aaplimg.com","10.133.147.141","TCP","1426","http(80)  >  49961 [ACK] Seq=97021 Ack=1 Win=251 Len=1386"
"112","0.128652","usmes2-vip-bx-001.aaplimg.com","10.133.147.141","TCP","1426","http(80)  >  49961 [ACK] Seq=98407 Ack=1 Win=251 Len=1386"
"113","0.129711","10.133.147.141","usmes2-vip-bx-001.aaplimg.com","TCP","40","49961  >  http(80) [ACK] Seq=1 Ack=99793 Win=2859 Len=0"
"114","0.130483","usmes2-vip-bx-001.aaplimg.com","10.133.147.141","TCP","1426","http(80)  >  49961 [ACK] Seq=99793 Ack=1 Win=251 Len=1386"
"115","0.131255","usmes2-vip-bx-001.aaplimg.com","10.133.147.141","TCP","1426","http(80)  >  49961 [ACK] Seq=101179 Ack=1 Win=251 Len=1386"
"116","0.132364","10.133.147.141","usmes2-vip-bx-001.aaplimg.com","TCP","40","49961  >  http(80) [ACK] Seq=1 Ack=102565 Win=2686 Len=0"
"117","0.133094","usmes2-vip-bx-001.aaplimg.com","10.133.147.141","TCP","1426","http(80)  >  49961 [ACK] Seq=102565 Ack=1 Win=251 Len=1386"
"118","0.133702","usmes2-vip-bx-001.aaplimg.com","10.133.147.141","TCP","1426","http(80)  >  49961 [ACK] Seq=103951 Ack=1 Win=251 Len=1386"
"119","0.134250","10.133.147.141","usmes2-vip-bx-001.aaplimg.com","TCP","40","49961  >  http(80) [ACK] Seq=1 Ack=105337 Win=2513 Len=0"
"120","0.134857","usmes2-vip-bx-001.aaplimg.com","10.133.147.141","TCP","1426","http(80)  >  49961 [ACK] Seq=105337 Ack=1 Win=251 Len=1386"
"121","0.135483","usmes2-vip-bx-001.aaplimg.com","10.133.147.141","TCP","1426","http(80)  >  49961 [ACK] Seq=106723 Ack=1 Win=251 Len=1386"
"122","0.136095","usmes2-vip-bx-001.aaplimg.com","10.133.147.141","TCP","1426","http(80)  >  49961 [ACK] Seq=108109 Ack=1 Win=251 Len=1386"
"123","0.136985","usmes2-vip-bx-001.aaplimg.com","10.133.147.141","TCP","1426","http(80)  >  49961 [ACK] Seq=109495 Ack=1 Win=251 Len=1386"
"124","0.137538","10.133.147.141","usmes2-vip-bx-001.aaplimg.com","TCP","40","49961  >  http(80) [ACK] Seq=1 Ack=108109 Win=2340 Len=0"
"125","0.138164","10.133.147.141","usmes2-vip-bx-001.aaplimg.com","TCP","40","49961  >  http(80) [ACK] Seq=1 Ack=110881 Win=2166 Len=0"
"126","0.139685","usmes2-vip-bx-001.aaplimg.com","10.133.147.141","TCP","1426","http(80)  >  49961 [ACK] Seq=110881 Ack=1 Win=251 Len=1386"
"127","0.140808","usmes2-vip-bx-001.aaplimg.com","10.133.147.141","TCP","1426","http(80)  >  49961 [ACK] Seq=112267 Ack=1 Win=251 Len=1386"
"128","0.141530","usmes2-vip-bx-001.aaplimg.com","10.133.147.141","TCP","1426","http(80)  >  49961 [ACK] Seq=113653 Ack=1 Win=251 Len=1386"
"129","0.142285","usmes2-vip-bx-001.aaplimg.com","10.133.147.141","TCP","1426","http(80)  >  49961 [ACK] Seq=115039 Ack=1 Win=251 Len=1386"
"130","0.143839","10.133.147.141","usmes2-vip-bx-001.aaplimg.com","TCP","40","49961  >  http(80) [ACK] Seq=1 Ack=113653 Win=1993 Len=0"
"131","0.144462","10.133.147.141","usmes2-vip-bx-001.aaplimg.com","TCP","40","49961  >  http(80) [ACK] Seq=1 Ack=116425 Win=1820 Len=0"
"132","0.145106","usmes2-vip-bx-001.aaplimg.com","10.133.147.141","TCP","1426","http(80)  >  49961 [ACK] Seq=116425 Ack=1 Win=251 Len=1386"
"133","0.145771","usmes2-vip-bx-001.aaplimg.com","10.133.147.141","TCP","1426","http(80)  >  49961 [ACK] Seq=117811 Ack=1 Win=251 Len=1386"
"134","0.147369","10.133.147.141","usmes2-vip-bx-001.aaplimg.com","TCP","40","49961  >  http(80) [ACK] Seq=1 Ack=119197 Win=1647 Len=0"
"135","0.148032","N/A","N/A","N/A","42","Raw packet data"
"136","0.148759","N/A","N/A","N/A","42","Raw packet data"
"137","0.149551","usmes2-vip-bx-001.aaplimg.com","10.133.147.141","TCP","1426","http(80)  >  49961 [ACK] Seq=119197 Ack=1 Win=251 Len=1386"
"138","0.150258","usmes2-vip-bx-001.aaplimg.com","10.133.147.141","TCP","1426","http(80)  >  49961 [ACK] Seq=120583 Ack=1 Win=251 Len=1386"
"139","0.150961","usmes2-vip-bx-001.aaplimg.com","10.133.147.141","TCP","1426","http(80)  >  49961 [ACK] Seq=121969 Ack=1 Win=251 Len=1386"
"140","0.151522","10.133.147.141","usmes2-vip-bx-001.aaplimg.com","TCP","40","49961  >  http(80) [ACK] Seq=1 Ack=121969 Win=1473 Len=0"
"141","0.152555","usmes2-vip-bx-001.aaplimg.com","10.133.147.141","TCP","1426","http(80)  >  49961 [ACK] Seq=123355 Ack=1 Win=251 Len=1386"
"142","0.153191","usmes2-vip-bx-001.aaplimg.com","10.133.147.141","TCP","1426","http(80)  >  49961 [ACK] Seq=124741 Ack=1 Win=251 Len=1386"
"143","0.153625","10.133.147.141","usmes2-vip-bx-001.aaplimg.com","TCP","40","49961  >  http(80) [ACK] Seq=1 Ack=124741 Win=1300 Len=0"
"144","0.154195","usmes2-vip-bx-001.aaplimg.com","10.133.147.141","TCP","1426","http(80)  >  49961 [ACK] Seq=126127 Ack=1 Win=251 Len=1386"
"145","0.154803","usmes2-vip-bx-001.aaplimg.com","10.133.147.141","TCP","1426","http(80)  >  49961 [ACK] Seq=127513 Ack=1 Win=251 Len=1386"
"146","0.157854","10.133.147.141","usmes2-vip-bx-001.aaplimg.com","TCP","40","49961  >  http(80) [ACK] Seq=1 Ack=127513 Win=1127 Len=0"
"147","0.158743","usmes2-vip-bx-001.aaplimg.com","10.133.147.141","TCP","1426","http(80)  >  49961 [ACK] Seq=128899 Ack=1 Win=251 Len=1386"
"148","0.159423","usmes2-vip-bx-001.aaplimg.com","10.133.147.141","TCP","1426","http(80)  >  49961 [ACK] Seq=130285 Ack=1 Win=251 Len=1386"
"149","0.160029","usmes2-vip-bx-001.aaplimg.com","10.133.147.141","TCP","1426","http(80)  >  49961 [ACK] Seq=131671 Ack=1 Win=251 Len=1386"
"150","0.161425","10.133.147.141","usmes2-vip-bx-001.aaplimg.com","TCP","40","49961  >  http(80) [ACK] Seq=1 Ack=130285 Win=954 Len=0"
"151","0.162405","10.133.147.141","usmes2-vip-bx-001.aaplimg.com","TCP","40","49961  >  http(80) [ACK] Seq=1 Ack=133057 Win=780 Len=0"
"152","0.163331","usmes2-vip-bx-001.aaplimg.com","10.133.147.141","TCP","1426","http(80)  >  49961 [ACK] Seq=133057 Ack=1 Win=251 Len=1386"
"153","0.164979","usmes2-vip-bx-001.aaplimg.com","10.133.147.141","TCP","1426","http(80)  >  49961 [ACK] Seq=134443 Ack=1 Win=251 Len=1386"
"154","0.165606","10.133.147.141","usmes2-vip-bx-001.aaplimg.com","TCP","40","49961  >  http(80) [ACK] Seq=1 Ack=135829 Win=607 Len=0"
"155","0.166251","usmes2-vip-bx-001.aaplimg.com","10.133.147.141","TCP","1426","http(80)  >  49961 [ACK] Seq=135829 Ack=1 Win=251 Len=1386"
"156","0.166874","usmes2-vip-bx-001.aaplimg.com","10.133.147.141","TCP","1426","http(80)  >  49961 [ACK] Seq=137215 Ack=1 Win=251 Len=1386"
"157","0.168007","usmes2-vip-bx-001.aaplimg.com","10.133.147.141","TCP","1426","http(80)  >  49961 [ACK] Seq=138601 Ack=1 Win=251 Len=1386"
"158","0.169012","10.133.147.141","usmes2-vip-bx-001.aaplimg.com","TCP","40","49961  >  http(80) [ACK] Seq=1 Ack=138601 Win=434 Len=0"
"159","0.169681","usmes2-vip-bx-001.aaplimg.com","10.133.147.141","TCP","1426","http(80)  >  49961 [ACK] Seq=139987 Ack=1 Win=251 Len=1386"
"160","0.170548","10.133.147.141","usmes2-vip-bx-001.aaplimg.com","TCP","40","49961  >  http(80) [ACK] Seq=1 Ack=141373 Win=261 Len=0"
"161","0.171156","N/A","N/A","N/A","42","Raw packet data"
"162","0.171760","N/A","N/A","N/A","42","Raw packet data"
"163","0.172303","N/A","N/A","N/A","42","Raw packet data"
"164","0.173177","N/A","N/A","N/A","42","Raw packet data"
"165","0.173886","N/A","N/A","N/A","42","Raw packet data"
"166","0.175522","N/A","N/A","N/A","42","Raw packet data"
"167","0.176043","N/A","N/A","N/A","42","Raw packet data"
"168","0.176615","N/A","N/A","N/A","42","Raw packet data"
"169","0.177261","N/A","N/A","N/A","42","Raw packet data"
"170","0.179017","usmes2-vip-bx-001.aaplimg.com","10.133.147.141","TCP","1426","http(80)  >  49961 [ACK] Seq=141373 Ack=1 Win=251 Len=1386"
"171","0.179646","usmes2-vip-bx-001.aaplimg.com","10.133.147.141","TCP","1426","http(80)  >  49961 [ACK] Seq=142759 Ack=1 Win=251 Len=1386"
"172","0.180609","usmes2-vip-bx-001.aaplimg.com","10.133.147.141","TCP","1426","http(80)  >  49961 [ACK] Seq=144145 Ack=1 Win=251 Len=1386"
"173","0.181296","10.133.147.141","usmes2-vip-bx-001.aaplimg.com","TCP","40","49961  >  http(80) [ACK] Seq=1 Ack=144145 Win=87 Len=0"
"174","0.182192","usmes2-vip-bx-001.aaplimg.com","10.133.147.141","TCP","60","http(80)  >  49961 [ACK] Seq=145531 Ack=1 Win=251 Len=20"
"175","0.182867","10.133.147.141","usmes2-vip-bx-001.aaplimg.com","TCP","40","[TCP ZeroWindow] 49961  >  http(80) [ACK] Seq=1 Ack=145551 Win=0 Len=0"
"176","0.183793","N/A","N/A","N/A","42","Raw packet data"
"177","0.184961","N/A","N/A","N/A","42","Raw packet data"
"178","0.185697","N/A","N/A","N/A","42","Raw packet data"
"179","0.186592","N/A","N/A","N/A","42","Raw packet data"
"180","0.188051","N/A","N/A","N/A","42","Raw packet data"
"181","0.188541","N/A","N/A","N/A","42","Raw packet data"
"182","0.189193","N/A","N/A","N/A","42","Raw packet data"
"183","0.189922","N/A","N/A","N/A","42","Raw packet data"
"184","0.190903","N/A","N/A","N/A","42","Raw packet data"
"185","0.191563","N/A","N/A","N/A","42","Raw packet data"
"186","0.192094","N/A","N/A","N/A","42","Raw packet data"
"187","0.192805","N/A","N/A","N/A","42","Raw packet data"
"188","0.193475","N/A","N/A","N/A","42","Raw packet data"
"189","0.194966","N/A","N/A","N/A","42","Raw packet data"
"190","0.196415","N/A","N/A","N/A","42","Raw packet data"
"191","0.197233","N/A","N/A","N/A","42","Raw packet data"
"192","0.197728","N/A","N/A","N/A","42","Raw packet data"
"193","0.198372","N/A","N/A","N/A","42","Raw packet data"
"194","0.199261","N/A","N/A","N/A","42","Raw packet data"
"195","0.199798","N/A","N/A","N/A","42","Raw packet data"
"196","0.200764","N/A","N/A","N/A","42","Raw packet data"
"197","0.201363","N/A","N/A","N/A","42","Raw packet data"
"198","0.202105","N/A","N/A","N/A","42","Raw packet data"
"199","0.202872","N/A","N/A","N/A","42","Raw packet data"
"200","0.203416","N/A","N/A","N/A","42","Raw packet data"
"201","0.204044","N/A","N/A","N/A","42","Raw packet data"
"202","0.204603","N/A","N/A","N/A","42","Raw packet data"
"203","0.205814","N/A","N/A","N/A","42","Raw packet data"
"204","0.208768","N/A","N/A","N/A","42","Raw packet data"
"205","0.209352","N/A","N/A","N/A","42","Raw packet data"
"206","0.210218","N/A","N/A","N/A","42","Raw packet data"
"207","0.210831","N/A","N/A","N/A","42","Raw packet data"
"208","0.211378","N/A","N/A","N/A","42","Raw packet data"
"209","0.211979","N/A","N/A","N/A","42","Raw packet data"
"210","0.212519","N/A","N/A","N/A","42","Raw packet data"
"211","0.214695","N/A","N/A","N/A","42","Raw packet data"
"212","0.215328","N/A","N/A","N/A","42","Raw packet data"
"213","0.216296","N/A","N/A","N/A","42","Raw packet data"
"214","0.216854","N/A","N/A","N/A","42","Raw packet data"
"215","0.217526","N/A","N/A","N/A","42","Raw packet data"
"216","0.218130","N/A","N/A","N/A","42","Raw packet data"
"217","0.218746","N/A","N/A","N/A","42","Raw packet data"
"218","0.219943","N/A","N/A","N/A","42","Raw packet data"
"219","0.221227","N/A","N/A","N/A","42","Raw packet data"
"220","0.221868","N/A","N/A","N/A","42","Raw packet data"
"221","0.222587","N/A","N/A","N/A","42","Raw packet data"
"222","0.223469","N/A","N/A","N/A","42","Raw packet data"
"223","0.224005","N/A","N/A","N/A","42","Raw packet data"
"224","0.224702","N/A","N/A","N/A","42","Raw packet data"
"225","0.225572","N/A","N/A","N/A","42","Raw packet data"
"226","0.230269","N/A","N/A","N/A","42","Raw packet data"
"227","0.231337","N/A","N/A","N/A","42","Raw packet data"
"228","0.232372","N/A","N/A","N/A","42","Raw packet data"
"229","0.233041","N/A","N/A","N/A","42","Raw packet data"
"230","0.233573","N/A","N/A","N/A","42","Raw packet data"
"231","0.234138","N/A","N/A","N/A","42","Raw packet data"
"232","0.234557","N/A","N/A","N/A","42","Raw packet data"
"233","0.235125","N/A","N/A","N/A","42","Raw packet data"
"234","0.235661","N/A","N/A","N/A","42","Raw packet data"
"235","0.236851","N/A","N/A","N/A","42","Raw packet data"
"236","0.237474","N/A","N/A","N/A","42","Raw packet data"
"237","0.238101","N/A","N/A","N/A","42","Raw packet data"
"238","0.239329","N/A","N/A","N/A","42","Raw packet data"
"239","0.240506","N/A","N/A","N/A","42","Raw packet data"
"240","0.241182","N/A","N/A","N/A","42","Raw packet data"
"241","0.241634","N/A","N/A","N/A","42","Raw packet data"
"242","0.242263","N/A","N/A","N/A","42","Raw packet data"
"243","0.242973","N/A","N/A","N/A","42","Raw packet data"
"244","0.243362","N/A","N/A","N/A","42","Raw packet data"
"245","0.244827","N/A","N/A","N/A","42","Raw packet data"
"246","0.246244","N/A","N/A","N/A","42","Raw packet data"
"247","0.247013","N/A","N/A","N/A","42","Raw packet data"
"248","0.249766","N/A","N/A","N/A","42","Raw packet data"
"249","0.250899","N/A","N/A","N/A","42","Raw packet data"
"250","0.252658","N/A","N/A","N/A","42","Raw packet data"
"251","0.253546","N/A","N/A","N/A","42","Raw packet data"
"252","0.254816","N/A","N/A","N/A","42","Raw packet data"
"253","0.255598","N/A","N/A","N/A","42","Raw packet data"
"254","0.256458","N/A","N/A","N/A","42","Raw packet data"
"255","0.257262","N/A","N/A","N/A","42","Raw packet data"
"256","0.258767","N/A","N/A","N/A","42","Raw packet data"
"257","0.259569","N/A","N/A","N/A","42","Raw packet data"
"258","0.260461","N/A","N/A","N/A","42","Raw packet data"
"259","0.261241","N/A","N/A","N/A","42","Raw packet data"
"260","0.262184","N/A","N/A","N/A","42","Raw packet data"
"261","0.263022","N/A","N/A","N/A","42","Raw packet data"
"262","0.264952","N/A","N/A","N/A","42","Raw packet data"
"263","0.265801","N/A","N/A","N/A","42","Raw packet data"
"264","0.266956","N/A","N/A","N/A","42","Raw packet data"
"265","0.268805","N/A","N/A","N/A","42","Raw packet data"
"266","0.269583","N/A","N/A","N/A","42","Raw packet data"
"267","0.270421","N/A","N/A","N/A","42","Raw packet data"
"268","0.271844","N/A","N/A","N/A","42","Raw packet data"
"269","0.272632","N/A","N/A","N/A","42","Raw packet data"
"270","0.273647","N/A","N/A","N/A","42","Raw packet data"
"271","0.275584","N/A","N/A","N/A","42","Raw packet data"
"272","0.276437","N/A","N/A","N/A","42","Raw packet data"
"273","0.277582","N/A","N/A","N/A","42","Raw packet data"
"274","0.278144","N/A","N/A","N/A","42","Raw packet data"
"275","0.279004","N/A","N/A","N/A","42","Raw packet data"
"276","0.280304","N/A","N/A","N/A","42","Raw packet data"
"277","0.281247","N/A","N/A","N/A","42","Raw packet data"
"278","0.282161","N/A","N/A","N/A","42","Raw packet data"
"279","0.283441","N/A","N/A","N/A","42","Raw packet data"
"280","0.284248","N/A","N/A","N/A","42","Raw packet data"
"281","0.285153","N/A","N/A","N/A","42","Raw packet data"
"282","0.286363","N/A","N/A","N/A","42","Raw packet data"
"283","0.287249","N/A","N/A","N/A","42","Raw packet data"
"284","0.288252","N/A","N/A","N/A","42","Raw packet data"
"285","0.290162","N/A","N/A","N/A","42","Raw packet data"
"286","0.290867","N/A","N/A","N/A","42","Raw packet data"
"287","0.292330","N/A","N/A","N/A","42","Raw packet data"
"288","0.293429","N/A","N/A","N/A","42","Raw packet data"
"289","0.294156","10.133.147.141","usmes2-vip-bx-001.aaplimg.com","TCP","40","[TCP Window Update] 49961  >  http(80) [ACK] Seq=1 Ack=145551 Win=4096 Len=0"
"290","0.295084","N/A","N/A","N/A","42","Raw packet data"
"291","0.295999","N/A","N/A","N/A","42","Raw packet data"
"292","0.297161","N/A","N/A","N/A","42","Raw packet data"
"293","0.298348","N/A","N/A","N/A","42","Raw packet data"
"294","0.299114","N/A","N/A","N/A","42","Raw packet data"
"295","0.300387","N/A","N/A","N/A","42","Raw packet data"
"296","0.301333","N/A","N/A","N/A","42","Raw packet data"
"297","0.302255","N/A","N/A","N/A","42","Raw packet data"
"298","0.303078","N/A","N/A","N/A","42","Raw packet data"
"299","0.303960","N/A","N/A","N/A","42","Raw packet data"
"300","0.304839","N/A","N/A","N/A","42","Raw packet data"
"301","0.306341","usmes2-vip-bx-001.aaplimg.com","10.133.147.141","TCP","1426","http(80)  >  49961 [ACK] Seq=145551 Ack=1 Win=251 Len=1386"
"302","0.308966","usmes2-vip-bx-001.aaplimg.com","10.133.147.141","TCP","1426","http(80)  >  49961 [ACK] Seq=146937 Ack=1 Win=251 Len=1386"
"303","0.312307","10.133.147.141","usmes2-vip-bx-001.aaplimg.com","TCP","40","49961  >  http(80) [ACK] Seq=1 Ack=148323 Win=3922 Len=0"
"304","0.313678","usmes2-vip-bx-001.aaplimg.com","10.133.147.141","TCP","1426","http(80)  >  49961 [ACK] Seq=148323 Ack=1 Win=251 Len=1386"
"305","0.314948","usmes2-vip-bx-001.aaplimg.com","10.133.147.141","TCP","1426","http(80)  >  49961 [ACK] Seq=149709 Ack=1 Win=251 Len=1386"
"306","0.315922","usmes2-vip-bx-001.aaplimg.com","10.133.147.141","TCP","1406","http(80)  >  49961 [ACK] Seq=151095 Ack=1 Win=251 Len=1366"
"307","0.317248","10.133.147.141","usmes2-vip-bx-001.aaplimg.com","TCP","40","49961  >  http(80) [ACK] Seq=1 Ack=151095 Win=3749 Len=0"
"308","0.318017","usmes2-vip-bx-001.aaplimg.com","10.133.147.141","TCP","1426","http(80)  >  49961 [ACK] Seq=152461 Ack=1 Win=251 Len=1386"
"309","0.318979","10.133.147.141","usmes2-vip-bx-001.aaplimg.com","TCP","40","49961  >  http(80) [ACK] Seq=1 Ack=153847 Win=3577 Len=0"
"310","0.319903","usmes2-vip-bx-001.aaplimg.com","10.133.147.141","TCP","1426","http(80)  >  49961 [ACK] Seq=153847 Ack=1 Win=251 Len=1386"
"311","0.320953","usmes2-vip-bx-001.aaplimg.com","10.133.147.141","TCP","1426","http(80)  >  49961 [ACK] Seq=155233 Ack=1 Win=251 Len=1386"
"312","0.321724","10.133.147.141","usmes2-vip-bx-001.aaplimg.com","TCP","40","49961  >  http(80) [ACK] Seq=1 Ack=156619 Win=3404 Len=0"
"313","0.322787","usmes2-vip-bx-001.aaplimg.com","10.133.147.141","TCP","1426","http(80)  >  49961 [ACK] Seq=156619 Ack=1 Win=251 Len=1386"
"314","0.323699","usmes2-vip-bx-001.aaplimg.com","10.133.147.141","TCP","1426","http(80)  >  49961 [ACK] Seq=158005 Ack=1 Win=251 Len=1386"
"315","0.324718","10.133.147.141","usmes2-vip-bx-001.aaplimg.com","TCP","40","49961  >  http(80) [ACK] Seq=1 Ack=159391 Win=3231 Len=0"
"316","0.326210","usmes2-vip-bx-001.aaplimg.com","10.133.147.141","TCP","1426","http(80)  >  49961 [ACK] Seq=159391 Ack=1 Win=251 Len=1386"
"317","0.327088","usmes2-vip-bx-001.aaplimg.com","10.133.147.141","TCP","1426","http(80)  >  49961 [ACK] Seq=160777 Ack=1 Win=251 Len=1386"
"318","0.328201","10.133.147.141","usmes2-vip-bx-001.aaplimg.com","TCP","40","49961  >  http(80) [ACK] Seq=1 Ack=162163 Win=3057 Len=0"
"319","0.328891","usmes2-vip-bx-001.aaplimg.com","10.133.147.141","TCP","1426","http(80)  >  49961 [ACK] Seq=162163 Ack=1 Win=251 Len=1386"
"320","0.329915","usmes2-vip-bx-001.aaplimg.com","10.133.147.141","TCP","1426","http(80)  >  49961 [ACK] Seq=163549 Ack=1 Win=251 Len=1386"
"321","0.330824","usmes2-vip-bx-001.aaplimg.com","10.133.147.141","TCP","1426","http(80)  >  49961 [ACK] Seq=164935 Ack=1 Win=251 Len=1386"
"322","0.332107","10.133.147.141","usmes2-vip-bx-001.aaplimg.com","TCP","40","49961  >  http(80) [ACK] Seq=1 Ack=164935 Win=2884 Len=0"
"323","0.333502","usmes2-vip-bx-001.aaplimg.com","10.133.147.141","TCP","1426","http(80)  >  49961 [ACK] Seq=166321 Ack=1 Win=251 Len=1386"
"324","0.334224","10.133.147.141","usmes2-vip-bx-001.aaplimg.com","TCP","40","49961  >  http(80) [ACK] Seq=1 Ack=167707 Win=2711 Len=0"
"325","0.335396","N/A","N/A","N/A","42","Raw packet data"
"326","0.336198","usmes2-vip-bx-001.aaplimg.com","10.133.147.141","TCP","1426","http(80)  >  49961 [ACK] Seq=167707 Ack=1 Win=251 Len=1386"
"327","0.336967","usmes2-vip-bx-001.aaplimg.com","10.133.147.141","TCP","1426","http(80)  >  49961 [ACK] Seq=169093 Ack=1 Win=251 Len=1386"
"328","0.338379","10.133.147.141","usmes2-vip-bx-001.aaplimg.com","TCP","40","49961  >  http(80) [ACK] Seq=1 Ack=170479 Win=2538 Len=0"
"329","0.339074","usmes2-vip-bx-001.aaplimg.com","10.133.147.141","TCP","1426","http(80)  >  49961 [ACK] Seq=170479 Ack=1 Win=251 Len=1386"
"330","0.340126","usmes2-vip-bx-001.aaplimg.com","10.133.147.141","TCP","1426","http(80)  >  49961 [ACK] Seq=171865 Ack=1 Win=251 Len=1386"
"331","0.341000","usmes2-vip-bx-001.aaplimg.com","10.133.147.141","TCP","1426","http(80)  >  49961 [ACK] Seq=173251 Ack=1 Win=251 Len=1386"
"332","0.342001","10.133.147.141","usmes2-vip-bx-001.aaplimg.com","TCP","40","49961  >  http(80) [ACK] Seq=1 Ack=173251 Win=2364 Len=0"
"333","0.343014","usmes2-vip-bx-001.aaplimg.com","10.133.147.141","TCP","1426","http(80)  >  49961 [ACK] Seq=174637 Ack=1 Win=251 Len=1386"
"334","0.343924","usmes2-vip-bx-001.aaplimg.com","10.133.147.141","TCP","1426","http(80)  >  49961 [ACK] Seq=176023 Ack=1 Win=251 Len=1386"
"335","0.344736","10.133.147.141","usmes2-vip-bx-001.aaplimg.com","TCP","40","49961  >  http(80) [ACK] Seq=1 Ack=176023 Win=2191 Len=0"
"336","0.345646","usmes2-vip-bx-001.aaplimg.com","10.133.147.141","TCP","1426","http(80)  >  49961 [ACK] Seq=177409 Ack=1 Win=251 Len=1386"
"337","0.346846","usmes2-vip-bx-001.aaplimg.com","10.133.147.141","TCP","1426","http(80)  >  49961 [ACK] Seq=178795 Ack=1 Win=251 Len=1386"
"338","0.347747","usmes2-vip-bx-001.aaplimg.com","10.133.147.141","TCP","1426","http(80)  >  49961 [ACK] Seq=180181 Ack=1 Win=251 Len=1386"
"339","0.348625","usmes2-vip-bx-001.aaplimg.com","10.133.147.141","TCP","1426","http(80)  >  49961 [ACK] Seq=181567 Ack=1 Win=251 Len=1386"
"340","0.349457","10.133.147.141","usmes2-vip-bx-001.aaplimg.com","TCP","40","49961  >  http(80) [ACK] Seq=1 Ack=178795 Win=2018 Len=0"
"341","0.350269","10.133.147.141","usmes2-vip-bx-001.aaplimg.com","TCP","40","49961  >  http(80) [ACK] Seq=1 Ack=181567 Win=1845 Len=0"
"342","0.351240","usmes2-vip-bx-001.aaplimg.com","10.133.147.141","TCP","1426","http(80)  >  49961 [ACK] Seq=182953 Ack=1 Win=251 Len=1386"
"343","0.352695","usmes2-vip-bx-001.aaplimg.com","10.133.147.141","TCP","1426","http(80)  >  49961 [ACK] Seq=184339 Ack=1 Win=251 Len=1386"
"344","0.353318","10.133.147.141","usmes2-vip-bx-001.aaplimg.com","TCP","40","49961  >  http(80) [ACK] Seq=1 Ack=184339 Win=1671 Len=0"
"345","0.354151","usmes2-vip-bx-001.aaplimg.com","10.133.147.141","TCP","1426","http(80)  >  49961 [ACK] Seq=185725 Ack=1 Win=251 Len=1386"
"346","0.355041","usmes2-vip-bx-001.aaplimg.com","10.133.147.141","TCP","1426","http(80)  >  49961 [ACK] Seq=187111 Ack=1 Win=251 Len=1386"
"347","0.355860","10.133.147.141","usmes2-vip-bx-001.aaplimg.com","TCP","40","49961  >  http(80) [ACK] Seq=1 Ack=187111 Win=1498 Len=0"
"348","0.356720","usmes2-vip-bx-001.aaplimg.com","10.133.147.141","TCP","1426","http(80)  >  49961 [ACK] Seq=188497 Ack=1 Win=251 Len=1386"
"349","0.358743","10.133.147.141","usmes2-vip-bx-001.aaplimg.com","TCP","40","49961  >  http(80) [ACK] Seq=1 Ack=189883 Win=1325 Len=0"
"350","0.359524","usmes2-vip-bx-001.aaplimg.com","10.133.147.141","TCP","1426","http(80)  >  49961 [ACK] Seq=189883 Ack=1 Win=251 Len=1386"
"351","0.360422","usmes2-vip-bx-001.aaplimg.com","10.133.147.141","TCP","1426","http(80)  >  49961 [ACK] Seq=191269 Ack=1 Win=251 Len=1386"
"352","0.361397","10.133.147.141","usmes2-vip-bx-001.aaplimg.com","TCP","40","49961  >  http(80) [ACK] Seq=1 Ack=192655 Win=1152 Len=0"
"353","0.362343","usmes2-vip-bx-001.aaplimg.com","10.133.147.141","TCP","1426","http(80)  >  49961 [ACK] Seq=192655 Ack=1 Win=251 Len=1386"
"354","0.363202","usmes2-vip-bx-001.aaplimg.com","10.133.147.141","TCP","1426","http(80)  >  49961 [ACK] Seq=194041 Ack=1 Win=251 Len=1386"
"355","0.364188","usmes2-vip-bx-001.aaplimg.com","10.133.147.141","TCP","1426","http(80)  >  49961 [ACK] Seq=195427 Ack=1 Win=251 Len=1386"
"356","0.365077","10.133.147.141","usmes2-vip-bx-001.aaplimg.com","TCP","40","49961  >  http(80) [ACK] Seq=1 Ack=195427 Win=978 Len=0"
"357","0.365828","usmes2-vip-bx-001.aaplimg.com","10.133.147.141","TCP","1426","http(80)  >  49961 [ACK] Seq=196813 Ack=1 Win=251 Len=1386"
"358","0.367128","usmes2-vip-bx-001.aaplimg.com","10.133.147.141","TCP","1426","http(80)  >  49961 [ACK] Seq=198199 Ack=1 Win=251 Len=1386"
"359","0.367934","usmes2-vip-bx-001.aaplimg.com","10.133.147.141","TCP","1426","http(80)  >  49961 [ACK] Seq=199585 Ack=1 Win=251 Len=1386"
"360","0.368651","10.133.147.141","usmes2-vip-bx-001.aaplimg.com","TCP","40","49961  >  http(80) [ACK] Seq=1 Ack=198199 Win=805 Len=0"
"361","0.369428","10.133.147.141","usmes2-vip-bx-001.aaplimg.com","TCP","40","49961  >  http(80) [ACK] Seq=1 Ack=200971 Win=632 Len=0"
"362","0.370491","usmes2-vip-bx-001.aaplimg.com","10.133.147.141","TCP","1426","http(80)  >  49961 [ACK] Seq=200971 Ack=1 Win=251 Len=1386"
"363","0.371281","usmes2-vip-bx-001.aaplimg.com","10.133.147.141","TCP","1426","http(80)  >  49961 [ACK] Seq=202357 Ack=1 Win=251 Len=1386"
"364","0.372172","usmes2-vip-bx-001.aaplimg.com","10.133.147.141","TCP","1426","http(80)  >  49961 [ACK] Seq=203743 Ack=1 Win=251 Len=1386"
"365","0.373518","usmes2-vip-bx-001.aaplimg.com","10.133.147.141","TCP","1426","http(80)  >  49961 [ACK] Seq=205129 Ack=1 Win=251 Len=1386"
"366","0.374392","10.133.147.141","usmes2-vip-bx-001.aaplimg.com","TCP","40","49961  >  http(80) [ACK] Seq=1 Ack=203743 Win=459 Len=0"
"367","0.375231","10.133.147.141","usmes2-vip-bx-001.aaplimg.com","TCP","40","49961  >  http(80) [ACK] Seq=1 Ack=206515 Win=285 Len=0"
"368","0.376113","usmes2-vip-bx-001.aaplimg.com","10.133.147.141","TCP","1426","http(80)  >  49961 [ACK] Seq=206515 Ack=1 Win=251 Len=1386"
"369","0.377355","usmes2-vip-bx-001.aaplimg.com","10.133.147.141","TCP","1426","http(80)  >  49961 [ACK] Seq=207901 Ack=1 Win=251 Len=1386"
"370","0.378057","10.133.147.141","usmes2-vip-bx-001.aaplimg.com","TCP","40","49961  >  http(80) [ACK] Seq=1 Ack=209287 Win=112 Len=0"
"371","0.379064","usmes2-vip-bx-001.aaplimg.com","10.133.147.141","TCP","1426","http(80)  >  49961 [ACK] Seq=209287 Ack=1 Win=251 Len=1386"
"372","0.379991","N/A","N/A","N/A","42","Raw packet data"
